title,selftext,subreddit,title_text
the map of tiny perfect things ,a very cutesy tale of two teenagers set up in a time loop with stunning scenery along with characters to root for it makes up for a light hearted feel good movieclick here if you wanna read my entire review on it s wwwinstagramcom p ,AmazonPrimeVideo,the map of tiny perfect things  a very cutesy tale of two teenagers set up in a time loop with stunning scenery along with characters to root for it makes up for a light hearted feel good movieclick here if you wanna read my entire review on it s wwwinstagramcom p 
is the new movie sound of metal unavailable in the uk is it every gonna come out on prime uk i asked a friend in italy to check if he can find it on amazon prime and he did i googled to see if it s out but even though everybody is saying it is for some reason i can t find it,,AmazonPrimeVideo,is the new movie sound of metal unavailable in the uk is it every gonna come out on prime uk i asked a friend in italy to check if he can find it on amazon prime and he did i googled to see if it s out but even though everybody is saying it is for some reason i can t find it 
phoebe waller bridge and donald glover will create and star in mr and mrs smith reboot series for amazon prime video,,AmazonPrimeVideo,phoebe waller bridge and donald glover will create and star in mr and mrs smith reboot series for amazon prime video 
will amazon release content on dvd at all ,possibly ,AmazonPrimeVideo,will amazon release content on dvd at all  possibly 
question on determining region for locked content,,AmazonPrimeVideo,question on determining region for locked content 
you re invited to join the cordcutting amp streaming tv discord,r amazonprimevideo invites you to join the cordcutting amp streaming tv discord which is affiliated with our subreddit it is a community for users of streaming services like amazon prime netflix and huluthis discord was started in august of for r disneyplus just before the disney launch since that time the server has expanded to nearly individuals realizing that many of us subscribe to multiple streaming services it made sense to unite with other subreddits and create a united community for fans of the mandalorian picard and bridgerton alike you can also discuss cordcutting get advice on the differences between streaming services and be alerted to deals and promotionsto prevent the discord from being overwhelming members will assign themselves roles based on the streaming services they are subscribed to to begin discussing streamers like amazon prime disney and hulu use the following link s discordgg happy watching ,AmazonPrimeVideo,you re invited to join the cordcutting amp streaming tv discord r amazonprimevideo invites you to join the cordcutting amp streaming tv discord which is affiliated with our subreddit it is a community for users of streaming services like amazon prime netflix and huluthis discord was started in august of for r disneyplus just before the disney launch since that time the server has expanded to nearly individuals realizing that many of us subscribe to multiple streaming services it made sense to unite with other subreddits and create a united community for fans of the mandalorian picard and bridgerton alike you can also discuss cordcutting get advice on the differences between streaming services and be alerted to deals and promotionsto prevent the discord from being overwhelming members will assign themselves roles based on the streaming services they are subscribed to to begin discussing streamers like amazon prime disney and hulu use the following link s discordgg happy watching 
can t download tv shows or movies on iphone or ipad,,AmazonPrimeVideo,can t download tv shows or movies on iphone or ipad 
is there a way to have all videos show in a grid that you scroll vertically ,for browsing titles i prefer to do it on my phone rather than the tv out of convenience but the gui is so terrible each row is a different category and it only shows videos and you have to keep scrolling to the right to see more and i m getting old and it s terrible for my carpal tunnel is there a way to make it show as just a big grid that i don t have to scroll horizontally at all just up and down also why does amazon prime only suggest old terrible movies it s telling me adams family us a popular movie along with other mediocre films like clue are people actually watching these any good show i want to watch don t get suggested to me i have to search them the gui needs a lot of work so disappointed that we pay for this,AmazonPrimeVideo,is there a way to have all videos show in a grid that you scroll vertically  for browsing titles i prefer to do it on my phone rather than the tv out of convenience but the gui is so terrible each row is a different category and it only shows videos and you have to keep scrolling to the right to see more and i m getting old and it s terrible for my carpal tunnel is there a way to make it show as just a big grid that i don t have to scroll horizontally at all just up and down also why does amazon prime only suggest old terrible movies it s telling me adams family us a popular movie along with other mediocre films like clue are people actually watching these any good show i want to watch don t get suggested to me i have to search them the gui needs a lot of work so disappointed that we pay for this
amazon movies bundle ,,AmazonPrimeVideo,amazon movies bundle  
why does my amazon prime come out with this when i try to load a show ,,AmazonPrimeVideo,why does my amazon prime come out with this when i try to load a show  
donald glover phoebe waller bridge to star in amazon s mr and mrs smith series,,AmazonPrimeVideo,donald glover phoebe waller bridge to star in amazon s mr and mrs smith series 
amazon prime video player on chrome rewatching episode issue,,AmazonPrimeVideo,amazon prime video player on chrome rewatching episode issue 
prime video player in chrome issue rewatching a watched episode,,AmazonPrimeVideo,prime video player in chrome issue rewatching a watched episode 
watched the misfits from on amazon prime video what a great film gable s best performance imho monroe and gable s final completed film directed by john huston and written by arthur miller,,AmazonPrimeVideo,watched the misfits from on amazon prime video what a great film gable s best performance imho monroe and gable s final completed film directed by john huston and written by arthur miller 
ads on prime video question,hi all so i ve been going through the show chicago med on my with prime video now it says watch free with ads and i got through seasons without a single ad then i go to my mom s house for the weekend and connect to her wifi and now i have ads i m wondering why this has changed anyone have any ideas i have xfinity with an ethernet cable at home is it maybe my internet package that s blocking the ads i don t have ads when the girlfriend and i watch chicago fire but she has ads on her smart tv,AmazonPrimeVideo,ads on prime video question hi all so i ve been going through the show chicago med on my with prime video now it says watch free with ads and i got through seasons without a single ad then i go to my mom s house for the weekend and connect to her wifi and now i have ads i m wondering why this has changed anyone have any ideas i have xfinity with an ethernet cable at home is it maybe my internet package that s blocking the ads i don t have ads when the girlfriend and i watch chicago fire but she has ads on her smart tv
what happened to mtv hits,,AmazonPrimeVideo,what happened to mtv hits 
win free amazon prime video accounts for easkme amazon prime video monthly giveaway,,AmazonPrimeVideo,win free amazon prime video accounts for easkme amazon prime video monthly giveaway 
is for all mankind available ,i love the show but is it there country doesn t matter ,AmazonPrimeVideo,is for all mankind available  i love the show but is it there country doesn t matter 
independence day vs take shelter vs the day after tomorrow what s the best disaster movie ever made ,,AmazonPrimeVideo,independence day vs take shelter vs the day after tomorrow what s the best disaster movie ever made  
accidentally skipped an episode and i can t go back ,,AmazonPrimeVideo,accidentally skipped an episode and i can t go back  
series based on the books that are based on movies like bladerunner and minority report,,AmazonPrimeVideo,series based on the books that are based on movies like bladerunner and minority report 
watch amazon prime video on chromecast without fire tv stick,,AmazonPrimeVideo,watch amazon prime video on chromecast without fire tv stick 
wtf prime video today you start with the black history reccomendations where were you last week ,asking for many friends,AmazonPrimeVideo,wtf prime video today you start with the black history reccomendations where were you last week  asking for many friends
without remorse tom clancy movie starring michael jordan out april ,,AmazonPrimeVideo,without remorse tom clancy movie starring michael jordan out april  
watched bliss from on amazon prime video what seriously weird movie,,AmazonPrimeVideo,watched bliss from on amazon prime video what seriously weird movie 
vikings episode currently unavailable ,,AmazonPrimeVideo,vikings episode currently unavailable  
vikings episode currently unavailable ,,AmazonPrimeVideo,vikings episode currently unavailable  
a limited series about the life of muhammad ali is in the works at amazon michael b jordan is set to executive produce but will not star,,AmazonPrimeVideo,a limited series about the life of muhammad ali is in the works at amazon michael b jordan is set to executive produce but will not star 
subtitles no longer have the options to remove the background window,so im sure you used to be able to get rid of the background window this but today every setting seems to come with a black window as background for subtitles im on firefox,AmazonPrimeVideo,subtitles no longer have the options to remove the background window so im sure you used to be able to get rid of the background window this but today every setting seems to come with a black window as background for subtitles im on firefox
the expanse,did anyone else have any glitchong issues with the last episodes of the new season of the expanse i can t work out if it s my tv my account or the show itself on the app but i ve not seen anything online it was mostly on episode there were green glitches and such and it made it hard to focus on the showif its my app or account is there any way to fix it ,AmazonPrimeVideo,the expanse did anyone else have any glitchong issues with the last episodes of the new season of the expanse i can t work out if it s my tv my account or the show itself on the app but i ve not seen anything online it was mostly on episode there were green glitches and such and it made it hard to focus on the showif its my app or account is there any way to fix it 
watched the cheap detective from comedy from neil simon with an amazing cast ,,AmazonPrimeVideo,watched the cheap detective from comedy from neil simon with an amazing cast  
would anyone care for a movie rental on me ,,AmazonPrimeVideo,would anyone care for a movie rental on me  
the subtitles just changed there is no longer an option for subtitles without a transparent border,,AmazonPrimeVideo,the subtitles just changed there is no longer an option for subtitles without a transparent border 
something like the boys,what are some shows or movies like the boys as its one of the only shows i like,AmazonPrimeVideo,something like the boys what are some shows or movies like the boys as its one of the only shows i like
um pr ncipe em nova york trailer oficial amazon prime video,,AmazonPrimeVideo,um pr ncipe em nova york trailer oficial amazon prime video 
android tv app switch profile ,is that not supported yet will it be supported on a new update how do you guys do it ,AmazonPrimeVideo,android tv app switch profile  is that not supported yet will it be supported on a new update how do you guys do it 
my controls have been gone for a bit now anyone else have this issue ,,AmazonPrimeVideo,my controls have been gone for a bit now anyone else have this issue  
watched the peanut butter falcon from just a fantastic little feel good movie ,,AmazonPrimeVideo,watched the peanut butter falcon from just a fantastic little feel good movie  
help,my wife and i sit down in the afternoons and watch some tv shows we have rewatched the same shows for awhile hawaii burn notice white collar ncis the glades we struggle at finding shows that sound like we would like them we have looked around and a lot of places say leverage is the next best one which we didn t like it was to out there on the characters what tv shows would you all recommend ,AmazonPrimeVideo,help my wife and i sit down in the afternoons and watch some tv shows we have rewatched the same shows for awhile hawaii burn notice white collar ncis the glades we struggle at finding shows that sound like we would like them we have looked around and a lot of places say leverage is the next best one which we didn t like it was to out there on the characters what tv shows would you all recommend 
new on amazon prime video in february ,,AmazonPrimeVideo,new on amazon prime video in february  
i m finding more and more excellent old movies an tv shows my latest discovery is one step beyond,one step beyond first aired in and ran for three seasons it s amazingly good considering the era if you re a fan of the original twilight zone i can almost guarantee you ll love this show definitely a nice break from some of the crap being made today you ll also see a lot of actors in the early days of their careers i ve been checking imdb for full cast listings of each episode interesting check it out and see what you think and if you have any similar recommendations please share,AmazonPrimeVideo,i m finding more and more excellent old movies an tv shows my latest discovery is one step beyond one step beyond first aired in and ran for three seasons it s amazingly good considering the era if you re a fan of the original twilight zone i can almost guarantee you ll love this show definitely a nice break from some of the crap being made today you ll also see a lot of actors in the early days of their careers i ve been checking imdb for full cast listings of each episode interesting check it out and see what you think and if you have any similar recommendations please share
amazon prime no longer allow hd viewing on many most internet browsers ,i mainly use macos and google chrome but have tried this on multiple browsers different computers and different internet services unfortunately the most i get is hd have never had this issue until the past few months does anyone know of a work around i often use it to take screenshots of films something safari does not allow ,AmazonPrimeVideo,amazon prime no longer allow hd viewing on many most internet browsers  i mainly use macos and google chrome but have tried this on multiple browsers different computers and different internet services unfortunately the most i get is hd have never had this issue until the past few months does anyone know of a work around i often use it to take screenshots of films something safari does not allow 
would you like to answer a quickamazon prime video survey ,hello i am a student from finland we have this course and our course project is to redesign a streaming service we chose amazon prime video because i d really like to try a redesign on the user experience it s not an in depth course and the survey certainly reflect s that the survey is about minutes long on average s formsofficecom pages responsepageaspx id cheers and thank you ,AmazonPrimeVideo,would you like to answer a quickamazon prime video survey  hello i am a student from finland we have this course and our course project is to redesign a streaming service we chose amazon prime video because i d really like to try a redesign on the user experience it s not an in depth course and the survey certainly reflect s that the survey is about minutes long on average s formsofficecom pages responsepageaspx id cheers and thank you 
screen record,how to screen record on prime video ,AmazonPrimeVideo,screen record how to screen record on prime video 
shows not going to next episode,i m currently watching a show that has multiple seasons and it s irritating that it sometimes goes back to a random season of an episode it says i didn t watch i don t understand why it can t always just leave off from my last episode watched and has to jump back season to an episode it shows as unplayed is this fixable ,AmazonPrimeVideo,shows not going to next episode i m currently watching a show that has multiple seasons and it s irritating that it sometimes goes back to a random season of an episode it says i didn t watch i don t understand why it can t always just leave off from my last episode watched and has to jump back season to an episode it shows as unplayed is this fixable 
watched the medusa touch from great thriller really worth watching ,,AmazonPrimeVideo,watched the medusa touch from great thriller really worth watching  
watch downloaded movie after it has been removed from prime ,so i noticed that godzilla king of the monsters will be removed from prime in about hours since i want to see it because of the godzilla vs kong movie that will come out can i download it and watch it after it has been removed from prime ,AmazonPrimeVideo,watch downloaded movie after it has been removed from prime  so i noticed that godzilla king of the monsters will be removed from prime in about hours since i want to see it because of the godzilla vs kong movie that will come out can i download it and watch it after it has been removed from prime 
the wilds is awesome ,this is probably one of the best shows i ve watched it s so well made the ending is just crazy amp i m excited for season ,AmazonPrimeVideo,the wilds is awesome  this is probably one of the best shows i ve watched it s so well made the ending is just crazy amp i m excited for season 
the great escapist,a couple episodes in and i really like it if it s ment to be over the top and staged cause it s just crazy what they are doing and yeah so i think it s supposed to be kind of a mockentary but actually learningbut love seeing tory belleci back on tv,AmazonPrimeVideo,the great escapist a couple episodes in and i really like it if it s ment to be over the top and staged cause it s just crazy what they are doing and yeah so i think it s supposed to be kind of a mockentary but actually learningbut love seeing tory belleci back on tv
cam you call it commercial free if you have to press skip to pass the commercial ,,AmazonPrimeVideo,cam you call it commercial free if you have to press skip to pass the commercial  
the secret world of nature spain trailer of this documentary series about the nature and animals of spain,,AmazonPrimeVideo,the secret world of nature spain trailer of this documentary series about the nature and animals of spain 
channel trials start without selecting them ,this is the fourth trial that has started without anyone in my household selecting it the previous one that was started i contacted amazon to ask how it got started and they said through website but no one in my household started it i m on the brink on cancelling my membership if i can t find a solution to stop these i changed my password last time and i ve been deleting fire devices off my account because i thought someone in my family started it but just didn t fess up to it however now that they said it was started through website i know no one in my family has started these trials how do i get it to stop edited spelling,AmazonPrimeVideo,channel trials start without selecting them  this is the fourth trial that has started without anyone in my household selecting it the previous one that was started i contacted amazon to ask how it got started and they said through website but no one in my household started it i m on the brink on cancelling my membership if i can t find a solution to stop these i changed my password last time and i ve been deleting fire devices off my account because i thought someone in my family started it but just didn t fess up to it however now that they said it was started through website i know no one in my family has started these trials how do i get it to stop edited spelling
playstation troubles,maybe y all can help me cause i m at my wits end here honestly i recently got prime up and running for the first time on my console gfs dad gave me his login so i could watch game of thrones again and start the boys and it just barely works on my playstation i m hit with hard crashes almost immediately every time i open the app it works maybe of the time and i ve tried everything i can on my end it s not my internet i run my through an ethernet cable because i live in a mildly secluded area i know it s not my internet either because i have a roku and it works fine on it video quality is ass though since it s running off of my standard wifi i ve uninstalled and reinstalled i ve deleted save date and cleared my consoles memory of the app nothing works and i m just super frustrated by it i ve looked into it and i either see prime just runs shitty on playstation or i see the steps i ve already taken to try to fix it there s nothing online that can point me in any direction on what to do like i said i can watch it on my roku i d just really rather not go down that route any help ,AmazonPrimeVideo,playstation troubles maybe y all can help me cause i m at my wits end here honestly i recently got prime up and running for the first time on my console gfs dad gave me his login so i could watch game of thrones again and start the boys and it just barely works on my playstation i m hit with hard crashes almost immediately every time i open the app it works maybe of the time and i ve tried everything i can on my end it s not my internet i run my through an ethernet cable because i live in a mildly secluded area i know it s not my internet either because i have a roku and it works fine on it video quality is ass though since it s running off of my standard wifi i ve uninstalled and reinstalled i ve deleted save date and cleared my consoles memory of the app nothing works and i m just super frustrated by it i ve looked into it and i either see prime just runs shitty on playstation or i see the steps i ve already taken to try to fix it there s nothing online that can point me in any direction on what to do like i said i can watch it on my roku i d just really rather not go down that route any help 
im confused,if a title is leaving prime and i download it can i watch it after it leaves prime ,AmazonPrimeVideo,im confused if a title is leaving prime and i download it can i watch it after it leaves prime 
when amazon loses the license do they warn you when a prime video is leaving ,like how netflix says last day to watch is date does amazon do the same thing or could i just wake up one day and my purchase disappears without warning i know they do lose the rights and then delete your stuff but is there a warning ,AmazonPrimeVideo,when amazon loses the license do they warn you when a prime video is leaving  like how netflix says last day to watch is date does amazon do the same thing or could i just wake up one day and my purchase disappears without warning i know they do lose the rights and then delete your stuff but is there a warning 
the marvelous mrs maisel and the need to be humbled,,AmazonPrimeVideo,the marvelous mrs maisel and the need to be humbled 
need a good film on amazon prime,does someone know a good film on amazon prime viedeo which is free ,AmazonPrimeVideo,need a good film on amazon prime does someone know a good film on amazon prime viedeo which is free 
currently unavailable video,so i ve been watching a video across the course of the day oats studio vol i ve a year old so it s not uncommon for me to watch something in a few sittings jumping from one device to another finally get him off to bed and think i ll finish that it s gone from my watch next i knew i hadn t finished it and it was the last thing i was watching searched for it found it went to play it and there s only a trailer option and a this video is currently unavailable text this has happened a few times now what s the deal ,AmazonPrimeVideo,currently unavailable video so i ve been watching a video across the course of the day oats studio vol i ve a year old so it s not uncommon for me to watch something in a few sittings jumping from one device to another finally get him off to bed and think i ll finish that it s gone from my watch next i knew i hadn t finished it and it was the last thing i was watching searched for it found it went to play it and there s only a trailer option and a this video is currently unavailable text this has happened a few times now what s the deal 
any good anti facist shows movies ,i am currently going through a lot of nazi propaganda and conspiracy bullshit for work and i find myself just wanting to see some anti facist stuff to glance my pallette i already watched the hunters what other prime movies and series would you guys recommend me ,AmazonPrimeVideo,any good anti facist shows movies  i am currently going through a lot of nazi propaganda and conspiracy bullshit for work and i find myself just wanting to see some anti facist stuff to glance my pallette i already watched the hunters what other prime movies and series would you guys recommend me 
bear in the big blue house episode home is where the bear is watch cartoons online watch anime online english dub anime,,AmazonPrimeVideo,bear in the big blue house episode home is where the bear is watch cartoons online watch anime online english dub anime 
