title,selftext,subreddit,title_text
am i the only one who thinks that amazon prime is very lacking in the animation game ,one thing i have noticed about amazon prime that makes it so different than netflix is that they re very lacking in terms of their original animated content one thing about netflix that made it so praised is how it is loaded with original animated content with stuff like bojack horseman the dragon prince and hilda being aimed at adults teens and kids respectively most of their animated shows were critically acclaimed won awards and got huge fan followings because of that some even considered netflix as a worthy rival to nickelodeon and cartoon network and just like those two studios netflix now bought office space and turned them into their newly established netflix animation studios which will be the home of in house animated contentand despite that prime video seems to be lagging behind with their original animated content their show just add could ve been a cute animated show aimed at girls but came across as a bland disney channel rip off and their shows are stuff people don t care about like if you gave a mouse a cookie or get little publicity anyone remember that oz cartoon they have even then there are some good stuff like dreamworks rocky and bullwinkle and kung fu panda shows that do get publicity but in general their library is so small compared to netflix hope they step up and make better quality shows their upcoming adult cartoon invincible looks promising so if it turns out good hope it might spark more interest for prime to make more cartoons like netflix,AmazonPrimeVideo,am i the only one who thinks that amazon prime is very lacking in the animation game  one thing i have noticed about amazon prime that makes it so different than netflix is that they re very lacking in terms of their original animated content one thing about netflix that made it so praised is how it is loaded with original animated content with stuff like bojack horseman the dragon prince and hilda being aimed at adults teens and kids respectively most of their animated shows were critically acclaimed won awards and got huge fan followings because of that some even considered netflix as a worthy rival to nickelodeon and cartoon network and just like those two studios netflix now bought office space and turned them into their newly established netflix animation studios which will be the home of in house animated contentand despite that prime video seems to be lagging behind with their original animated content their show just add could ve been a cute animated show aimed at girls but came across as a bland disney channel rip off and their shows are stuff people don t care about like if you gave a mouse a cookie or get little publicity anyone remember that oz cartoon they have even then there are some good stuff like dreamworks rocky and bullwinkle and kung fu panda shows that do get publicity but in general their library is so small compared to netflix hope they step up and make better quality shows their upcoming adult cartoon invincible looks promising so if it turns out good hope it might spark more interest for prime to make more cartoons like netflix
ultimate revenge, amp s previewreddit png width amp format png amp auto webp amp s ,AmazonPrimeVideo,ultimate revenge  amp s previewreddit png width amp format png amp auto webp amp s 
buying movies shows from other countries,i m from germany and there are no free options to watch the office us without using a vpn this is why i started buying the season on amazon since the german translation was only continued until season it s the last show you can buy on the german amazon is it possible to buy the remaining season on the amazon from a different country and watch it without a vpn i have always watched it in english so it doesn t really matter where i buy it as long as i can watch it here,AmazonPrimeVideo,buying movies shows from other countries i m from germany and there are no free options to watch the office us without using a vpn this is why i started buying the season on amazon since the german translation was only continued until season it s the last show you can buy on the german amazon is it possible to buy the remaining season on the amazon from a different country and watch it without a vpn i have always watched it in english so it doesn t really matter where i buy it as long as i can watch it here
why cant i use amazon prime video even though i have gift card balance why do i need to provide a credit card number if i am pre paying ,it s a horrible experience for the user,AmazonPrimeVideo,why cant i use amazon prime video even though i have gift card balance why do i need to provide a credit card number if i am pre paying  it s a horrible experience for the user
volume increases after exiting pause,i f i pause video then press play then video is really loud this is webversion prime video using desktop pc and ffonly prime video does thisnot youtube etc,AmazonPrimeVideo,volume increases after exiting pause i f i pause video then press play then video is really loud this is webversion prime video using desktop pc and ffonly prime video does thisnot youtube etc
is the office leaving prime video cause i cant seem to get a definite answer when i search online and if so when would it leave ,,AmazonPrimeVideo,is the office leaving prime video cause i cant seem to get a definite answer when i search online and if so when would it leave  
why can t my subtitles load on chrome ,i ve tried clearing chrome s cache and i ve made sure that chrome is up to date and i still can t get subtitles does anyone have a solution for this ,AmazonPrimeVideo,why can t my subtitles load on chrome  i ve tried clearing chrome s cache and i ve made sure that chrome is up to date and i still can t get subtitles does anyone have a solution for this 
controlling prime video with alexa,i can open prime video on my firestick with alexa but how do i select my profile its driving me nuts ,AmazonPrimeVideo,controlling prime video with alexa i can open prime video on my firestick with alexa but how do i select my profile its driving me nuts 
how do you stream amazon prime onto discord or does it not work ,,AmazonPrimeVideo,how do you stream amazon prime onto discord or does it not work  
is it just me or is prime video sucking on all older devices , roku tvs and different rokus all cheap all lagging and glitchy with prime video and my internet is fiber optic so it s not that is it just the cheap devices and they can t handle amazon prime video no other apps have any problems seems to be just prime video any ideas it s weird because i stream and cast shit all the time and prime video app is the only thing that functions like a drunk hobo,AmazonPrimeVideo,is it just me or is prime video sucking on all older devices   roku tvs and different rokus all cheap all lagging and glitchy with prime video and my internet is fiber optic so it s not that is it just the cheap devices and they can t handle amazon prime video no other apps have any problems seems to be just prime video any ideas it s weird because i stream and cast shit all the time and prime video app is the only thing that functions like a drunk hobo
been binge watching hells kitchen and it randomly got moved to imdb tv ,does anyone else find it scummy that something amazon had available on prime suddenly moves to imdb tv also owned by amazon except it plays ads on all its content,AmazonPrimeVideo,been binge watching hells kitchen and it randomly got moved to imdb tv  does anyone else find it scummy that something amazon had available on prime suddenly moves to imdb tv also owned by amazon except it plays ads on all its content
interviewing at amazon prime video looking for suggestions on what you d improve,i m having my final rounds of interviews with amazon prime video next week i ve got a handful of ideas i m thinking about on areas i d improve but i m curious what things about the service you d improve besides more different better content user interface improvements search results new features what really annoys you what do you love and how would you improve it,AmazonPrimeVideo,interviewing at amazon prime video looking for suggestions on what you d improve i m having my final rounds of interviews with amazon prime video next week i ve got a handful of ideas i m thinking about on areas i d improve but i m curious what things about the service you d improve besides more different better content user interface improvements search results new features what really annoys you what do you love and how would you improve it
alert when movie moves to included with prime,i subscribe to a number of services that provide me access to movies because of this i try to watch only those films that are included in these services free amazon prime video and hulu of my main targets for thishas anyone found a site or method to do so thanks ,AmazonPrimeVideo,alert when movie moves to included with prime i subscribe to a number of services that provide me access to movies because of this i try to watch only those films that are included in these services free amazon prime video and hulu of my main targets for thishas anyone found a site or method to do so thanks 
legal alternative to watch party ,i want to run a watch party for a horror movie that is available for rent on amazon prime however the amazon prime chat line said that the movie is not available for watch party is there a legal alternative for watching the movie online as a group from multiple locations at once ,AmazonPrimeVideo,legal alternative to watch party  i want to run a watch party for a horror movie that is available for rent on amazon prime however the amazon prime chat line said that the movie is not available for watch party is there a legal alternative for watching the movie online as a group from multiple locations at once 
prepaid credit cards ,does anyone know if amazon will take a prepaid credit card visa or mastercard when signing up for the prime video free trial ,AmazonPrimeVideo,prepaid credit cards  does anyone know if amazon will take a prepaid credit card visa or mastercard when signing up for the prime video free trial 
autoplay ending credits skips minutes,the autoplay function when watching a tvshow it skips credits and about of the tv show before it ends absoulety horrific just when a show is a knife edge the next episode starts shocking,AmazonPrimeVideo,autoplay ending credits skips minutes the autoplay function when watching a tvshow it skips credits and about of the tv show before it ends absoulety horrific just when a show is a knife edge the next episode starts shocking
does the content of primevideo differ per user location or amazon location ,i live in belgium and there is no belgian amazon if we want to use amazon prime we can choose from all our surrounding countries uk nl de fr if you want to get a prime subscription for any of these the prices differ drastically that raises the question what is actually the difference between all of them one difference i d guess would be that the video content differs because of where you get the prime subscription but i am not entirely sure for netflix you see the content that is available to your region as a user but is that also the case for prime video or is the content determined by where you take the subscription rather than where you are located as a user ,AmazonPrimeVideo,does the content of primevideo differ per user location or amazon location  i live in belgium and there is no belgian amazon if we want to use amazon prime we can choose from all our surrounding countries uk nl de fr if you want to get a prime subscription for any of these the prices differ drastically that raises the question what is actually the difference between all of them one difference i d guess would be that the video content differs because of where you get the prime subscription but i am not entirely sure for netflix you see the content that is available to your region as a user but is that also the case for prime video or is the content determined by where you take the subscription rather than where you are located as a user 
eddie murphy is back in coming to america ,check this very cool then amp now videohow does the cast of look now s youtube amp s previewreddit png width amp format png amp auto webp amp s ,AmazonPrimeVideo,eddie murphy is back in coming to america  check this very cool then amp now videohow does the cast of look now s youtube amp s previewreddit png width amp format png amp auto webp amp s 
what time do movies release ,borat releases on the its currently here in australia so only hours away nobody can seem to tell me if its going to be out at midnight for me or give me any sort of time frame so i know whether to stay awake or not does anybody know xd,AmazonPrimeVideo,what time do movies release  borat releases on the its currently here in australia so only hours away nobody can seem to tell me if its going to be out at midnight for me or give me any sort of time frame so i know whether to stay awake or not does anybody know xd
join mirzapur subreddit,,AmazonPrimeVideo,join mirzapur subreddit 
mirzapur season in plans while fans seek to boycott season ,,AmazonPrimeVideo,mirzapur season in plans while fans seek to boycott season  
some movies unavailable on pc ,i wanted to watch hot fuzz on prime video but there doesnt seem to be a button to play from prime video subscription and you can only rent buy it i was sure that i could watch it from my phone for free so i double checked it and i was right do i have to install the prime video app on my pc or what its so weird,AmazonPrimeVideo,some movies unavailable on pc  i wanted to watch hot fuzz on prime video but there doesnt seem to be a button to play from prime video subscription and you can only rent buy it i was sure that i could watch it from my phone for free so i double checked it and i was right do i have to install the prime video app on my pc or what its so weird
 borat subsequent moviefilm is shocking insane and even crazier than the first one ,,AmazonPrimeVideo, borat subsequent moviefilm is shocking insane and even crazier than the first one  
how to stop the apv plex app going back to home page,amazon prime video s plex app was updated a while back though interstitial ads are now skippable the app automatically takes you to the home page where presumably it wants to advertise you the stuff it wants you to watch rather than showing you where you were if you go to any other app on your tv and then return to amazonthis is in itself an annoying ad meaning that you either have to put what you were watching in your watch list or do a search and tediously navigate back to itworst of all when you do refocus back to the amazon plex app it will initially show you where you were ie episode of a show but it won t let you engage with the interface just takes you straight back to the home page,AmazonPrimeVideo,how to stop the apv plex app going back to home page amazon prime video s plex app was updated a while back though interstitial ads are now skippable the app automatically takes you to the home page where presumably it wants to advertise you the stuff it wants you to watch rather than showing you where you were if you go to any other app on your tv and then return to amazonthis is in itself an annoying ad meaning that you either have to put what you were watching in your watch list or do a search and tediously navigate back to itworst of all when you do refocus back to the amazon plex app it will initially show you where you were ie episode of a show but it won t let you engage with the interface just takes you straight back to the home page
afi fest uncle frank review,,AmazonPrimeVideo,afi fest uncle frank review 
yo niggas can you stop playing a fucking ad every time i open the app ,,AmazonPrimeVideo,yo niggas can you stop playing a fucking ad every time i open the app  
prime video on xbox one something went wrong every single damn day ,anyone got a fix for this i swear i have to hard reset the xbox clear it s cache and reset it s network settings every single day but prime video still does this so annoying sometimes can t get more than minutes through something before it does it again,AmazonPrimeVideo,prime video on xbox one something went wrong every single damn day  anyone got a fix for this i swear i have to hard reset the xbox clear it s cache and reset it s network settings every single day but prime video still does this so annoying sometimes can t get more than minutes through something before it does it again
i m able to rent movies with an empty gift card ,i recently removed my debit card from my amazon account and left on an empty prepaid giftcard that i had used on there about a year ago this wasn t really intentional i m just lazy i meant to add on a different card when i removed my debit card but got distracted and a few days later wanted to rent a movie from prime video forgetting that i had not added a new card i rented the movie it went through successfully and i watched it i later realized which card had been used and curiously tried renting a different movie which also went through i tried purchasing a movie and amazon asked me to update my payment method i again tried renting a movie afterwards and again it went through will the cost of renting these movies be claimed once i add a valid card i have no way of checking the balance on the card i threw it away a long time ago and can only see the last digits on my account now but there s a very very slim chance that it had just enough funds on it to rent movies if not does anyone know if amazon allows this type of transaction to go through either purposely or unintentionally ,AmazonPrimeVideo,i m able to rent movies with an empty gift card  i recently removed my debit card from my amazon account and left on an empty prepaid giftcard that i had used on there about a year ago this wasn t really intentional i m just lazy i meant to add on a different card when i removed my debit card but got distracted and a few days later wanted to rent a movie from prime video forgetting that i had not added a new card i rented the movie it went through successfully and i watched it i later realized which card had been used and curiously tried renting a different movie which also went through i tried purchasing a movie and amazon asked me to update my payment method i again tried renting a movie afterwards and again it went through will the cost of renting these movies be claimed once i add a valid card i have no way of checking the balance on the card i threw it away a long time ago and can only see the last digits on my account now but there s a very very slim chance that it had just enough funds on it to rent movies if not does anyone know if amazon allows this type of transaction to go through either purposely or unintentionally 
the boys terror needs more screen time in season ,,AmazonPrimeVideo,the boys terror needs more screen time in season  
these data storage rates seem really low like yesterday it was for best i still have files dled new files seem poor qualitywhats up ,,AmazonPrimeVideo,these data storage rates seem really low like yesterday it was for best i still have files dled new files seem poor qualitywhats up  
the boys terror needs more screen time in season ,,AmazonPrimeVideo,the boys terror needs more screen time in season  
hdr on fe ,this is a screen watching for example the grand tour which states it is and hdr on the programme page when playing back it just says hd is it only playing back automatically because the screen is only and if so should it be playing back but hdr ,AmazonPrimeVideo,hdr on fe  this is a screen watching for example the grand tour which states it is and hdr on the programme page when playing back it just says hd is it only playing back automatically because the screen is only and if so should it be playing back but hdr 
what happened to the sea patrol series ,prime video keeps showing each episode as not available ,AmazonPrimeVideo,what happened to the sea patrol series  prime video keeps showing each episode as not available 
on demand tv research undergrads at the schulich school of business,hello members and visitors of the r amazonprimevideo sub i am an undergraduate student at the schulich school of business york university in ontario canada i have created this survey impart of a research project that i and others are doing on the recent growth in the on demand tv industry seeming that amazon prime comes with prime video incentives i am looking for your helpit would be greatly appreciated if you kind redditors could answer this short question survey s formsgle thank you in advance ,AmazonPrimeVideo,on demand tv research undergrads at the schulich school of business hello members and visitors of the r amazonprimevideo sub i am an undergraduate student at the schulich school of business york university in ontario canada i have created this survey impart of a research project that i and others are doing on the recent growth in the on demand tv industry seeming that amazon prime comes with prime video incentives i am looking for your helpit would be greatly appreciated if you kind redditors could answer this short question survey s formsgle thank you in advance 
what time of day are new releases added to prime video ,borat comes out oct will it be available at midnight gmt on ,AmazonPrimeVideo,what time of day are new releases added to prime video  borat comes out oct will it be available at midnight gmt on 
anybody watched spell ,i found it to be pretty good very interesting to say the least first movie i ve seen about any icelandic folklore,AmazonPrimeVideo,anybody watched spell  i found it to be pretty good very interesting to say the least first movie i ve seen about any icelandic folklore
watch our black box review this movie should be getting more traction it was really good ,,AmazonPrimeVideo,watch our black box review this movie should be getting more traction it was really good  
can i host a prime watch party with someone if i was the one to rent the movie ,i want to watch a movie with my friend but it requires we rent it i feel bad having them pay and i don t mind to so if i rent it can they watch via the party or do they have to rent too amp thnx,AmazonPrimeVideo,can i host a prime watch party with someone if i was the one to rent the movie  i want to watch a movie with my friend but it requires we rent it i feel bad having them pay and i don t mind to so if i rent it can they watch via the party or do they have to rent too amp thnx
terrible app,trying to watch foxcatcher wont let me put subtitles on wont let me pause and wont let me even fucking rewind trying to work with the shittiest ui of any streaming service doesnt make any of this any more enjoyable when this years up im done with amazon prime,AmazonPrimeVideo,terrible app trying to watch foxcatcher wont let me put subtitles on wont let me pause and wont let me even fucking rewind trying to work with the shittiest ui of any streaming service doesnt make any of this any more enjoyable when this years up im done with amazon prime
wtfthat new greenland movie with gerard butler was suppose to start streaming today oct ,wtf happened i see its now going to hbo max in december amp just google greenland oct amazon prime a bunch of articles from weeks to a month agojust yesterday day before it was suppose to stream all the recent articles are its going to hbo max and pvoddid amazon lose the deal or what ,AmazonPrimeVideo,wtfthat new greenland movie with gerard butler was suppose to start streaming today oct  wtf happened i see its now going to hbo max in december amp just google greenland oct amazon prime a bunch of articles from weeks to a month agojust yesterday day before it was suppose to stream all the recent articles are its going to hbo max and pvoddid amazon lose the deal or what 
check out my latest double review first i reviewed the mamoudou athie led film black box second i reviewed the garrett bradley directed documentary time which drops on amazon prime friday check out both reviews inside ,,AmazonPrimeVideo,check out my latest double review first i reviewed the mamoudou athie led film black box second i reviewed the garrett bradley directed documentary time which drops on amazon prime friday check out both reviews inside  
the boys season review as good as season one ,,AmazonPrimeVideo,the boys season review as good as season one  
forced subtitles automatically show up in german even though no subtitle language is selected,i finally started watching the boys and noticed the forced subtitles subtitles for characters speaking foreign languages or signs in foreign languages showed up in german i m in the us so i checked my settings and no subtitles was selected i had to switch the settings to english and then turn them off again so they were correct i was using the app from my phone and casting it to my chromecast has anyone else experienced this thanks ,AmazonPrimeVideo,forced subtitles automatically show up in german even though no subtitle language is selected i finally started watching the boys and noticed the forced subtitles subtitles for characters speaking foreign languages or signs in foreign languages showed up in german i m in the us so i checked my settings and no subtitles was selected i had to switch the settings to english and then turn them off again so they were correct i was using the app from my phone and casting it to my chromecast has anyone else experienced this thanks 
