title,selftext,subreddit,title_text
the wilds had no criticism and this is bad ,we live in the day and age of echo chambers all the major media outlets are celebrating the show as the better version of lost due to amazon prime having content accessible only after a sub of course not all small web cinema critics make reviews so sometimes you find very few articles or videos online but this time the silence of criticism is kinda deafeningi wish here i can find someone else thay didn t appreciate the wilds but if not i wish at least that the conversation stays moderate and respectful spoilers this is what i didn t like gretchen is not a character she is a walking totem of third wave feminism all of her social commentary was not subtle in any way it was out in your face with the purpose of being annoying i am sorry but you can tame opinions but you can tame feelings my feeling was disgust premise i am atheist but i am sickened by the representation of religious people in the series it is the same story with life is strange if you are gamers religious people are always the bigots or the monsters in disguise i don t like that idea because religious people are humans too and they can vary on a wide scale of personality loud and abnoxius use of profanity that was always pulling me away it was so much incredibly abnoxius that it felt unreal gaining the opposite effect of what it should have i was fine with the lesbian loves they didn t feel forced like most stuff in the series but the love story in summer school in episode between one of the girls and that awkward kid it is just impossible i am mostly offended by that cause i had an awkward love story myself and i guarantee the best thing for me was to end it up put away the security blanket and mature the hell up the series instead tells you it is totally fine to give yourself to cringey relationships like that just cause they make you feel good oh plus as if it was needed the couple had to be interracial as that is the cool trend i am not saying you cant have interracial relationships displayed in a series but this was just a postcard for all the possible virtue signaling one can think of before some actual bigot call me racist i had a very long interracial relationship so stfu a long list of illogical things and inconsistencies i don t have the time to list and plot holes in general i think it is just the same series pandering to a certain audience that just likes to see progressive and brave imagery spouted over and over to deconstruct social expectations i can tell you the only thing it succeeded at deconstructing was my respect for the director involved in the making of this series all it missed was an acab moment and it would qualify as postmodernist patchwork of art par exellance wish i spent minutes better,AmazonPrimeVideo,the wilds had no criticism and this is bad  we live in the day and age of echo chambers all the major media outlets are celebrating the show as the better version of lost due to amazon prime having content accessible only after a sub of course not all small web cinema critics make reviews so sometimes you find very few articles or videos online but this time the silence of criticism is kinda deafeningi wish here i can find someone else thay didn t appreciate the wilds but if not i wish at least that the conversation stays moderate and respectful spoilers this is what i didn t like gretchen is not a character she is a walking totem of third wave feminism all of her social commentary was not subtle in any way it was out in your face with the purpose of being annoying i am sorry but you can tame opinions but you can tame feelings my feeling was disgust premise i am atheist but i am sickened by the representation of religious people in the series it is the same story with life is strange if you are gamers religious people are always the bigots or the monsters in disguise i don t like that idea because religious people are humans too and they can vary on a wide scale of personality loud and abnoxius use of profanity that was always pulling me away it was so much incredibly abnoxius that it felt unreal gaining the opposite effect of what it should have i was fine with the lesbian loves they didn t feel forced like most stuff in the series but the love story in summer school in episode between one of the girls and that awkward kid it is just impossible i am mostly offended by that cause i had an awkward love story myself and i guarantee the best thing for me was to end it up put away the security blanket and mature the hell up the series instead tells you it is totally fine to give yourself to cringey relationships like that just cause they make you feel good oh plus as if it was needed the couple had to be interracial as that is the cool trend i am not saying you cant have interracial relationships displayed in a series but this was just a postcard for all the possible virtue signaling one can think of before some actual bigot call me racist i had a very long interracial relationship so stfu a long list of illogical things and inconsistencies i don t have the time to list and plot holes in general i think it is just the same series pandering to a certain audience that just likes to see progressive and brave imagery spouted over and over to deconstruct social expectations i can tell you the only thing it succeeded at deconstructing was my respect for the director involved in the making of this series all it missed was an acab moment and it would qualify as postmodernist patchwork of art par exellance wish i spent minutes better
amazon prime video january movie and tv titles announced,,AmazonPrimeVideo,amazon prime video january movie and tv titles announced 
amazon up to their old tricks with skipping unwanted trailers,before most shows and movies there is a forced trailer for other prime content i hate that but that s another storyon fire sticks you can skip the trailer by pressing up gt right gt ok but sometimes the right doesn t happen even when you press it so you add the show movie to watchlist instead which you didn t want to do i think this is entirely intentional by amazon just one of many irritations with prime video i guess something i now pay closer attention to,AmazonPrimeVideo,amazon up to their old tricks with skipping unwanted trailers before most shows and movies there is a forced trailer for other prime content i hate that but that s another storyon fire sticks you can skip the trailer by pressing up gt right gt ok but sometimes the right doesn t happen even when you press it so you add the show movie to watchlist instead which you didn t want to do i think this is entirely intentional by amazon just one of many irritations with prime video i guess something i now pay closer attention to
can you still watch movies that have been removed if you download them ,,AmazonPrimeVideo,can you still watch movies that have been removed if you download them  
is it more reasonable to add disney to amazon prime or hulu ,is it more reasonable to add disney to amazon prime or hulu i am not interested in espn at all,AmazonPrimeVideo,is it more reasonable to add disney to amazon prime or hulu  is it more reasonable to add disney to amazon prime or hulu i am not interested in espn at all
i have activated two amazon prime subscriptions please help me , hi everybody today i went to twitch and saw an ad for prime amazon i linked my card and activated free tail prime for seven days after minutes i went to amazon s website and activated free tail prime for days what should i do please explain to me are my subscriptions compatible will i be debited for days of the free period or for days upd i first activated days on prime video later in minutes i activated days on amazon i untied my card i was afraid will i be able to withdraw money i got scared and canceled my subscription for days do i still have a day subscription s previewreddit png width amp format png amp auto webp amp s s previewreddit png width amp format png amp auto webp amp s ,AmazonPrimeVideo,i have activated two amazon prime subscriptions please help me   hi everybody today i went to twitch and saw an ad for prime amazon i linked my card and activated free tail prime for seven days after minutes i went to amazon s website and activated free tail prime for days what should i do please explain to me are my subscriptions compatible will i be debited for days of the free period or for days upd i first activated days on prime video later in minutes i activated days on amazon i untied my card i was afraid will i be able to withdraw money i got scared and canceled my subscription for days do i still have a day subscription s previewreddit png width amp format png amp auto webp amp s s previewreddit png width amp format png amp auto webp amp s 
a lot of great movies are leaving dec none have been added ,i have amazon prime video subscriptioncontent is very limited in my country i understand it is because of licencing issues and because of that i always looked at prime video as a service where i could watch great old movies and amazon original content never seen it as a service where i could watch new movies i was fine with thatbut now under almost every movie in my watch list i see that it is leaving dec a lot of great movies from last years are being removed all the great movies i planned to watch there awesome comedies from and great action movies from and most of them will be gonewhat is the plan exactly they never add anything new good and constantly are removing one thing they had great old movies the list of good content there is slim for my country i feel like nothing will be left after dec example the heattrue gritthe man who knew too littlethe hunt for red octobersum of all fearsmunichentrapmentthe fight cluball the movies i wanted to watch again at one pointeverything that was added in last few months were of hindi movies don t get me wrong i know there are amazing movies coming from indiajust not my cup of tea,AmazonPrimeVideo,a lot of great movies are leaving dec none have been added  i have amazon prime video subscriptioncontent is very limited in my country i understand it is because of licencing issues and because of that i always looked at prime video as a service where i could watch great old movies and amazon original content never seen it as a service where i could watch new movies i was fine with thatbut now under almost every movie in my watch list i see that it is leaving dec a lot of great movies from last years are being removed all the great movies i planned to watch there awesome comedies from and great action movies from and most of them will be gonewhat is the plan exactly they never add anything new good and constantly are removing one thing they had great old movies the list of good content there is slim for my country i feel like nothing will be left after dec example the heattrue gritthe man who knew too littlethe hunt for red octobersum of all fearsmunichentrapmentthe fight cluball the movies i wanted to watch again at one pointeverything that was added in last few months were of hindi movies don t get me wrong i know there are amazing movies coming from indiajust not my cup of tea
free nostalgia , imgurcom a i m hoping for some grade a nostalgia but i m not entirely sure this isn t some ploy to trick me into paying ep if anyone could clear things up it d be much appreciatedhow does the promotional credit work i buy it and get a sort of gift card with added to my account i pay and walk away with some free nostalgia or do i pay and still magically get the added as some evidence that a god does exist ,AmazonPrimeVideo,free nostalgia   imgurcom a i m hoping for some grade a nostalgia but i m not entirely sure this isn t some ploy to trick me into paying ep if anyone could clear things up it d be much appreciatedhow does the promotional credit work i buy it and get a sort of gift card with added to my account i pay and walk away with some free nostalgia or do i pay and still magically get the added as some evidence that a god does exist 
watch history for multiple accounts,when you go to view your watch history it combines all watch history from all profiles this must also mean that it bases recommendations off of all accounts rather than per profile why ,AmazonPrimeVideo,watch history for multiple accounts when you go to view your watch history it combines all watch history from all profiles this must also mean that it bases recommendations off of all accounts rather than per profile why 
very dark in uhd ,i ve read others complaining about this in prime video but i can not find a solution any tips or links would be appreciated,AmazonPrimeVideo,very dark in uhd  i ve read others complaining about this in prime video but i can not find a solution any tips or links would be appreciated
prime vid app data usage when innactive,so the prime video app in win is using approx kb s download when nothing is streaming buffering or downloading it s just sitting there static using up kb s completely idle are they doing some sneaky shit data mining or is this an innocent horrible design anyone know edit it continues to pull bandwidth when app is closed i have to go into task manager and scroll to the absolute bottom of processes list and click end task to stop this app from persistently using kb s of data for no apparent purpose,AmazonPrimeVideo,prime vid app data usage when innactive so the prime video app in win is using approx kb s download when nothing is streaming buffering or downloading it s just sitting there static using up kb s completely idle are they doing some sneaky shit data mining or is this an innocent horrible design anyone know edit it continues to pull bandwidth when app is closed i have to go into task manager and scroll to the absolute bottom of processes list and click end task to stop this app from persistently using kb s of data for no apparent purpose
procedurals,please tell me about some procedurals movies or series,AmazonPrimeVideo,procedurals please tell me about some procedurals movies or series
in full bloom finally dropped on prime ,,AmazonPrimeVideo,in full bloom finally dropped on prime  
so i guess purchasing a prime video is really just longer term renting,,AmazonPrimeVideo,so i guess purchasing a prime video is really just longer term renting 
problem with captions,i am working my way through the man in high castle currently coming to the end of season loving the show but i am just having problems with the captions i don t need captions on the for the english dialogue but was hoping the subtitles would come on automatically for the japanese and german scenes at the moment i have to pause the show and turn on the english captions so i can understand the scenes then turn them back off when it goes back to englishi am watching on the windows app on my laptop any ideas of how to fix this would be amazing d,AmazonPrimeVideo,problem with captions i am working my way through the man in high castle currently coming to the end of season loving the show but i am just having problems with the captions i don t need captions on the for the english dialogue but was hoping the subtitles would come on automatically for the japanese and german scenes at the moment i have to pause the show and turn on the english captions so i can understand the scenes then turn them back off when it goes back to englishi am watching on the windows app on my laptop any ideas of how to fix this would be amazing d
tom hanks is spot on with this statement,,AmazonPrimeVideo,tom hanks is spot on with this statement 
where did season of the expanse go ,,AmazonPrimeVideo,where did season of the expanse go  
hotel impossible removed ,husband and i have been working through hotel impossible and went to watch it tonight and it s gone it s getting annoying that this keeps happening,AmazonPrimeVideo,hotel impossible removed  husband and i have been working through hotel impossible and went to watch it tonight and it s gone it s getting annoying that this keeps happening
i just finished the wilds amp loved it anyone want to discuss it ,,AmazonPrimeVideo,i just finished the wilds amp loved it anyone want to discuss it  
rant about movies going on prime,okay so i realize that this isn t entirely amazon s fault and it ll come across as an entitled rant but i m so disenfranchised virtually every movie i ve bought recently on amazon has moved to prime for free viewing and it s something that really gets under my skin it s the equivalent of throwing money away i m no longer going to buy any movie or tv show off amazon for that reason you have no idea what will be added to prime in the future and i m so fed up of getting burned on purchasing things that are eventually offered for free i purchased a movie for sixteen days ago and it s just magically been added to prime it s such a flaw on amazon s part and i imagine they get a fair chunk of change doing this is there any way to complain about this practice and get your money back have any of you done this in the past they should offer refunds even partial refunds for purchased movies that move to prime i d be curious to know if any of you have brought this up with amazon and managed to get a refund or at least a response from them ,AmazonPrimeVideo,rant about movies going on prime okay so i realize that this isn t entirely amazon s fault and it ll come across as an entitled rant but i m so disenfranchised virtually every movie i ve bought recently on amazon has moved to prime for free viewing and it s something that really gets under my skin it s the equivalent of throwing money away i m no longer going to buy any movie or tv show off amazon for that reason you have no idea what will be added to prime in the future and i m so fed up of getting burned on purchasing things that are eventually offered for free i purchased a movie for sixteen days ago and it s just magically been added to prime it s such a flaw on amazon s part and i imagine they get a fair chunk of change doing this is there any way to complain about this practice and get your money back have any of you done this in the past they should offer refunds even partial refunds for purchased movies that move to prime i d be curious to know if any of you have brought this up with amazon and managed to get a refund or at least a response from them 
is prime gaming included with prime video subscription , i have had prime video for about a month i claimed prime gaming today and it s asking for what s this charge about is prime gaming not included with prime video ,AmazonPrimeVideo,is prime gaming included with prime video subscription   i have had prime video for about a month i claimed prime gaming today and it s asking for what s this charge about is prime gaming not included with prime video 
is amazon now releasing their shows in the format of first three episodes at once then the remaining episodes weekly ,first the boys now the expanse anyone know of any other amazon shows being treated this way ,AmazonPrimeVideo,is amazon now releasing their shows in the format of first three episodes at once then the remaining episodes weekly  first the boys now the expanse anyone know of any other amazon shows being treated this way 
my short film on amazon prime usa,the official video of second short film the plot on amazon prime s wwwamazoncom dp ,AmazonPrimeVideo,my short film on amazon prime usa the official video of second short film the plot on amazon prime s wwwamazoncom dp 
prime video on browser smarttv app ui amp content localization,hi i have my prime subscription through s amazonde but i m not german is there a way a setting somewhere in the app my profile somewhere to make the ui and content default to english rather than german i know i can change the audio and subtitles but even they don t seem to work fully sometimes the video content has bits spoken in another language and there are hard coded subtitles in german but no english overlay subtitlesany suggestions ,AmazonPrimeVideo,prime video on browser smarttv app ui amp content localization hi i have my prime subscription through s amazonde but i m not german is there a way a setting somewhere in the app my profile somewhere to make the ui and content default to english rather than german i know i can change the audio and subtitles but even they don t seem to work fully sometimes the video content has bits spoken in another language and there are hard coded subtitles in german but no english overlay subtitlesany suggestions 
no chance trailer itn feat vernon wells available on amazon prime video intentional parody of arnold schwarzenegger winner of arnold hosted sound alike contest ,,AmazonPrimeVideo,no chance trailer itn feat vernon wells available on amazon prime video intentional parody of arnold schwarzenegger winner of arnold hosted sound alike contest  
problem rewinding with amazon prime video interface with smart tv,hi i recently purchased a vizio smart tv the remote works fine with netflix and hulu however i couldn t rewind or fast forward on amazon prime i did trouble shooting for an hour with vizio it seemed more like an amazon video interface problem i just realized that there is a way to rewind but it s very unwieldywhen i press the pause button on the remote i see a yellow pause symbol in the middle of my screento the left of it is a white fast rewind symbolin order to rewind i have to press the left arrow on my remote this moves the focus to the fast rewind icon which turns yellow in order to activate rewind i have to press the center pause play button on my remote to stop rewind i have to hit the right arrow on my remote so that the center pause icon is yellow selected then i have to hit the center pause button again to pauseit s so unwieldy it s not functional by the time i press the pause button it s rewound all the way to the beginning of the movie it takes four seperate steps to rewindin other words there is not a proportional way to rewind it takes several different steps to rewindis there a fix for this thanks in advance for any help or suggestions i really appreciate it,AmazonPrimeVideo,problem rewinding with amazon prime video interface with smart tv hi i recently purchased a vizio smart tv the remote works fine with netflix and hulu however i couldn t rewind or fast forward on amazon prime i did trouble shooting for an hour with vizio it seemed more like an amazon video interface problem i just realized that there is a way to rewind but it s very unwieldywhen i press the pause button on the remote i see a yellow pause symbol in the middle of my screento the left of it is a white fast rewind symbolin order to rewind i have to press the left arrow on my remote this moves the focus to the fast rewind icon which turns yellow in order to activate rewind i have to press the center pause play button on my remote to stop rewind i have to hit the right arrow on my remote so that the center pause icon is yellow selected then i have to hit the center pause button again to pauseit s so unwieldy it s not functional by the time i press the pause button it s rewound all the way to the beginning of the movie it takes four seperate steps to rewindin other words there is not a proportional way to rewind it takes several different steps to rewindis there a fix for this thanks in advance for any help or suggestions i really appreciate it
how do you improve change video quality on ,got amazon prime on a smart tv and the quality is good if it s directly through the smart tv but when i try playing it through the app on the which i need to do for headphone reasons it drops significantly and doesn t improve absolutely nowhere can i find any video quality bitrate settings online it mentions that the option should be in settings but again however i try to access them phone pc etc they are missingis it something that unlocks after your free trial is over or something ,AmazonPrimeVideo,how do you improve change video quality on  got amazon prime on a smart tv and the quality is good if it s directly through the smart tv but when i try playing it through the app on the which i need to do for headphone reasons it drops significantly and doesn t improve absolutely nowhere can i find any video quality bitrate settings online it mentions that the option should be in settings but again however i try to access them phone pc etc they are missingis it something that unlocks after your free trial is over or something 
please tell me a movie where the protagonist dies and a movie where he doesn t die in random order,the idea is to collect a list of movies in some of which the protagonist dies but i shouldn t know which onesfeel free to tell me more than movie per tipe eg movies where the protagonist dies and movies where the protagonist doesn t die,AmazonPrimeVideo,please tell me a movie where the protagonist dies and a movie where he doesn t die in random order the idea is to collect a list of movies in some of which the protagonist dies but i shouldn t know which onesfeel free to tell me more than movie per tipe eg movies where the protagonist dies and movies where the protagonist doesn t die
found a debug menu on the amazon prime video app on the with a cheat code,,AmazonPrimeVideo,found a debug menu on the amazon prime video app on the with a cheat code 
short film released on amazon prime,the official video of second short film the plot on amazon prime for usa customerss wwwamazoncom dp ,AmazonPrimeVideo,short film released on amazon prime the official video of second short film the plot on amazon prime for usa customerss wwwamazoncom dp 
