title,selftext,subreddit,title_text
any stack tv subscribers here ,,AmazonPrimeVideo,any stack tv subscribers here  
chromecast,,AmazonPrimeVideo,chromecast 
using digital reward credit for channel subscriptions,i ve got some digital rewards for no rush shipping that expire soon i wondered if i could use them toward a premium channel like paramount ,AmazonPrimeVideo,using digital reward credit for channel subscriptions i ve got some digital rewards for no rush shipping that expire soon i wondered if i could use them toward a premium channel like paramount 
infinite loading during ads,,AmazonPrimeVideo,infinite loading during ads 
infinite loading screen whenever an ad tries to load,,AmazonPrimeVideo,infinite loading screen whenever an ad tries to load 
anyone know what time clarkson s farm on prime ,hi anyone know what time uk or est clarkson s farm is available to stream ,AmazonPrimeVideo,anyone know what time clarkson s farm on prime  hi anyone know what time uk or est clarkson s farm is available to stream 
confused,so i m a bit confused here i am watching yugioh duel monsters and it says season is included with imdbtv when i click on episodes from season and however it still lets me watch them why is this ,AmazonPrimeVideo,confused so i m a bit confused here i am watching yugioh duel monsters and it says season is included with imdbtv when i click on episodes from season and however it still lets me watch them why is this 
so channel subscriptions do not include all the content that streaming channel has to offer ,i ve been rewatching the mythbusters series and so i subscribed to discovery through prime video my friend who is subscribed directly through discovery has access to all the seasons included but when i try to watch through my prime channel subscription amazon asks me to pay for each episode this seems wrong ,AmazonPrimeVideo,so channel subscriptions do not include all the content that streaming channel has to offer  i ve been rewatching the mythbusters series and so i subscribed to discovery through prime video my friend who is subscribed directly through discovery has access to all the seasons included but when i try to watch through my prime channel subscription amazon asks me to pay for each episode this seems wrong 
why i have mixed feelings over the family man season s ending and season setup,,AmazonPrimeVideo,why i have mixed feelings over the family man season s ending and season setup 
the creepiest movie from my childhood is on prime video,it s called the adventures of mark twain it s a claymation film from the i remembered being freaked out by it as a kid and i thought i d see if it s as freaky as i remember oh boy is it ever if you don t want to watch the whole thing the scariest part starts at the minute mark,AmazonPrimeVideo,the creepiest movie from my childhood is on prime video it s called the adventures of mark twain it s a claymation film from the i remembered being freaked out by it as a kid and i thought i d see if it s as freaky as i remember oh boy is it ever if you don t want to watch the whole thing the scariest part starts at the minute mark
great spy series the family man,,AmazonPrimeVideo,great spy series the family man 
watched knowing from on amazon prime video a fun sci fi thriller with nicolas cage,,AmazonPrimeVideo,watched knowing from on amazon prime video a fun sci fi thriller with nicolas cage 
g,,AmazonPrimeVideo,g 
indiana jones ,,AmazonPrimeVideo,indiana jones  
recommendations,,AmazonPrimeVideo,recommendations 
the boys season first look of jensen ackles as soldier boy cinemablind,,AmazonPrimeVideo,the boys season first look of jensen ackles as soldier boy cinemablind 
brainwashing isn t all that bad the wilds,,AmazonPrimeVideo,brainwashing isn t all that bad the wilds 
 the boys first look at jensen ackles as soldier boy,,AmazonPrimeVideo, the boys first look at jensen ackles as soldier boy 
major websites including ny times cnn amazon amp more have hour long outages due to server issue,,AmazonPrimeVideo,major websites including ny times cnn amazon amp more have hour long outages due to server issue 
debate invincible or the boys ,,AmazonPrimeVideo,debate invincible or the boys  
trying to help my folks,their favorite types of shows are those on hgtv diy network and travel shows any recommendations in those categories so it will help customize what prime recommends to them ,AmazonPrimeVideo,trying to help my folks their favorite types of shows are those on hgtv diy network and travel shows any recommendations in those categories so it will help customize what prime recommends to them 
cast ,,AmazonPrimeVideo,cast  
cast ,,AmazonPrimeVideo,cast  
amazon prime video redesigned their layout sort of and it s worse ,,AmazonPrimeVideo,amazon prime video redesigned their layout sort of and it s worse  
the family man review,,AmazonPrimeVideo,the family man review 
watched the killer elite from on amazon prime video great cast the first american movie to feature ninjas,,AmazonPrimeVideo,watched the killer elite from on amazon prime video great cast the first american movie to feature ninjas 
is there any way to buy a movie series instead of one at a time ,there are several movie series i d rather enjoy getting on my prime account but they all seem to only be available to purchase one at a time is there any sort of option to buy the whole set at once instead of getting them one by one like when i used to buy dvd box sets instead of each individual dvd ,AmazonPrimeVideo,is there any way to buy a movie series instead of one at a time  there are several movie series i d rather enjoy getting on my prime account but they all seem to only be available to purchase one at a time is there any sort of option to buy the whole set at once instead of getting them one by one like when i used to buy dvd box sets instead of each individual dvd 
the family man season ,,AmazonPrimeVideo,the family man season  
dark shadows the beginning almost included in prime not included in prime,dark shadows the beginning season are included with prime so says the description s wwwamazoncom gp video detail ref but not episode of season i have to buy episode of season for sd there is no other option i can skip ep and watch ep and the rest without any purchase included with prime isn t it false advertising to say the season is included with prime but not selected episodes ,AmazonPrimeVideo,dark shadows the beginning almost included in prime not included in prime dark shadows the beginning season are included with prime so says the description s wwwamazoncom gp video detail ref but not episode of season i have to buy episode of season for sd there is no other option i can skip ep and watch ep and the rest without any purchase included with prime isn t it false advertising to say the season is included with prime but not selected episodes 
does changing your audio subtitles on one device and picking up the movie series on another one keeps the one selected for that content or does it save the one on the device ,,AmazonPrimeVideo,does changing your audio subtitles on one device and picking up the movie series on another one keeps the one selected for that content or does it save the one on the device  
hannibal is one of my favourite shows and i think it s pretty underrated if gore doesn t freak you out i can only recommend this masterpiece have fun,,AmazonPrimeVideo,hannibal is one of my favourite shows and i think it s pretty underrated if gore doesn t freak you out i can only recommend this masterpiece have fun 
films on amazon constantly dropping from for a moment then back help ,,AmazonPrimeVideo,films on amazon constantly dropping from for a moment then back help  
watched the sixth sense from on amazon prime video great horror thriller from m night shyamalan,,AmazonPrimeVideo,watched the sixth sense from on amazon prime video great horror thriller from m night shyamalan 
watch amazon prime and netflix with friends,,AmazonPrimeVideo,watch amazon prime and netflix with friends 
prime hbo max,does anyone know if prime offers you a choice of either the tier or tier if you are getting prime hbo max looking at the hbo schedule it lists some movies in which is not supported in the tier just or is hbo max on prime only for the tier ,AmazonPrimeVideo,prime hbo max does anyone know if prime offers you a choice of either the tier or tier if you are getting prime hbo max looking at the hbo schedule it lists some movies in which is not supported in the tier just or is hbo max on prime only for the tier 
imbtv seemingly overriding other subscriptions,,AmazonPrimeVideo,imbtv seemingly overriding other subscriptions 
prime video slaps you with a pay wall when you back out of a video that s supposed to be included with prime to check details,,AmazonPrimeVideo,prime video slaps you with a pay wall when you back out of a video that s supposed to be included with prime to check details 
 one day at a time alum justina machado to star in amazon pilot horror of dolores roach roxann dawson to direct,,AmazonPrimeVideo, one day at a time alum justina machado to star in amazon pilot horror of dolores roach roxann dawson to direct 
bosch season official trailer,,AmazonPrimeVideo,bosch season official trailer 
different video selections on different devices,,AmazonPrimeVideo,different video selections on different devices 
can t find the english version for naruto canada ,i can t find the english sub or dub version for naruto and naruto related shows i don t even know why it s all written in french when my prime video language is set to english is there a way to fix this processing img ,AmazonPrimeVideo,can t find the english version for naruto canada  i can t find the english sub or dub version for naruto and naruto related shows i don t even know why it s all written in french when my prime video language is set to english is there a way to fix this processing img 
mary j blige s my life official trailer prime video,,AmazonPrimeVideo,mary j blige s my life official trailer prime video 
producers on amazon s prisma where twins challenge gender norms,,AmazonPrimeVideo,producers on amazon s prisma where twins challenge gender norms 
prime video is skipping episodes and seasons ,new to prime video im watching the office i always press next episode today i find out selecting from episodes list that at least half of the episodes of three seasons were skipped i resumed today and it said season but the whole season was skipped and i didnt finished the third yet wtf is this bug anyone experienced that its so annoying i realized i skipped soo many episodes and im mad rn,AmazonPrimeVideo,prime video is skipping episodes and seasons  new to prime video im watching the office i always press next episode today i find out selecting from episodes list that at least half of the episodes of three seasons were skipped i resumed today and it said season but the whole season was skipped and i didnt finished the third yet wtf is this bug anyone experienced that its so annoying i realized i skipped soo many episodes and im mad rn
prime video is skipping episodes and seasons ,,AmazonPrimeVideo,prime video is skipping episodes and seasons  
tried to get free trial and i got charged,,AmazonPrimeVideo,tried to get free trial and i got charged 
how to adjust amazon prime video quality or resolution when using google chromecast ,,AmazonPrimeVideo,how to adjust amazon prime video quality or resolution when using google chromecast  
how high level is the region locking ,,AmazonPrimeVideo,how high level is the region locking  
new releases that came out on prime video in may ,,AmazonPrimeVideo,new releases that came out on prime video in may  
at what time do films tend to be released on prime in britain ,so i m waiting for the new saw film spiral to be released on prime and according to google it ll be released tomorrow so i was wondering what time will the film likely be available to me assuming of course that google was correct about the release date to streaming services thanks in advance,AmazonPrimeVideo,at what time do films tend to be released on prime in britain  so i m waiting for the new saw film spiral to be released on prime and according to google it ll be released tomorrow so i was wondering what time will the film likely be available to me assuming of course that google was correct about the release date to streaming services thanks in advance
apps think i m in different country,,AmazonPrimeVideo,apps think i m in different country 
apps think i m in different country,,AmazonPrimeVideo,apps think i m in different country 
amazon and mgm s mega deal what movies tv shows does it own ,,AmazonPrimeVideo,amazon and mgm s mega deal what movies tv shows does it own  
amul indian diary company celebrates amazon mgm deal ,,AmazonPrimeVideo,amul indian diary company celebrates amazon mgm deal  
does anybody else s prime video app only show amazon originals and does anyone know how to fix it ,,AmazonPrimeVideo,does anybody else s prime video app only show amazon originals and does anyone know how to fix it  
help when i download videos it downloads in a different language but when i watch them online it is back in english,,AmazonPrimeVideo,help when i download videos it downloads in a different language but when i watch them online it is back in english 
zabardastzindabadamazing,,AmazonPrimeVideo,zabardastzindabadamazing 
amazon prime video quality incredibly bad,,AmazonPrimeVideo,amazon prime video quality incredibly bad 
amazon prime video quality incredibly bad,,AmazonPrimeVideo,amazon prime video quality incredibly bad 
wild dog villain entry bgm prathish keyboard ,,AmazonPrimeVideo,wild dog villain entry bgm prathish keyboard  
how do i watch this but i am subscribed,,AmazonPrimeVideo,how do i watch this but i am subscribed 
how do i watch this but i subscribed to it,,AmazonPrimeVideo,how do i watch this but i subscribed to it 
 space odyssey will be available on prime video ,,AmazonPrimeVideo, space odyssey will be available on prime video  
watched world s greatest dad from on amazon prime video good flick robin williams is great directed by bobcat goldthwait,,AmazonPrimeVideo,watched world s greatest dad from on amazon prime video good flick robin williams is great directed by bobcat goldthwait 
will the quiet place be available to watch on prime video tomorrow ,,AmazonPrimeVideo,will the quiet place be available to watch on prime video tomorrow  
indie film makers,,AmazonPrimeVideo,indie film makers 
save amazon save the world,,AmazonPrimeVideo,save amazon save the world 
ads throughout prime video,has anyone else seen ads placed throughout their prime videos as of recent i have minute ads placed throughout prime content this has never happened before i think they may be testing it to see if customers will complain and if they don t they ll make it permanent i don t mind paying extra for an ad free experience but to introduce it without any notification seems shady,AmazonPrimeVideo,ads throughout prime video has anyone else seen ads placed throughout their prime videos as of recent i have minute ads placed throughout prime content this has never happened before i think they may be testing it to see if customers will complain and if they don t they ll make it permanent i don t mind paying extra for an ad free experience but to introduce it without any notification seems shady
watched angel heart from on amazon prime video great flick good cast fun thriller ,,AmazonPrimeVideo,watched angel heart from on amazon prime video great flick good cast fun thriller  
amazon to buy mgm studios for billion,,AmazonPrimeVideo,amazon to buy mgm studios for billion 
amazon buys mgm studio behind james bond for billion,,AmazonPrimeVideo,amazon buys mgm studio behind james bond for billion 
amazon series adaptation of the expatriates casts ji young yoo,,AmazonPrimeVideo,amazon series adaptation of the expatriates casts ji young yoo 
amazon said to be near deal to buy mgm for billion report,,AmazonPrimeVideo,amazon said to be near deal to buy mgm for billion report 
here s what s coming to amazon prime and imdb tv in june ,,AmazonPrimeVideo,here s what s coming to amazon prime and imdb tv in june  
is it possible to share my prime video account with someone who doesn t live with me ,can we watch at the same time what do i need to do any help greatly appreciated,AmazonPrimeVideo,is it possible to share my prime video account with someone who doesn t live with me  can we watch at the same time what do i need to do any help greatly appreciated
solos amazon prime ending explained review recap amp breakdown solos ,,AmazonPrimeVideo,solos amazon prime ending explained review recap amp breakdown solos  
has anyone watched solos the character in each episode is linked to a previous episode character but i can t seem to figure out how tom in epi is related to leah in epi somebody pls help xd,,AmazonPrimeVideo,has anyone watched solos the character in each episode is linked to a previous episode character but i can t seem to figure out how tom in epi is related to leah in epi somebody pls help xd 
why is the video quality so god awful ,i m using chrome on windows btw and i m pretty sure it s not my fault youtube s pretty sharp and my internet connection is strong,AmazonPrimeVideo,why is the video quality so god awful  i m using chrome on windows btw and i m pretty sure it s not my fault youtube s pretty sharp and my internet connection is strong
why is there no anime on the dutch prime video ,why is there no anime on the dutch prime video there are some shows i want to watch that are only available on prime video but they are not available in the netherlands they are available in other countries like germany and the usa does anybody know if that is going to change ,AmazonPrimeVideo,why is there no anime on the dutch prime video  why is there no anime on the dutch prime video there are some shows i want to watch that are only available on prime video but they are not available in the netherlands they are available in other countries like germany and the usa does anybody know if that is going to change 
watched barbarella from on amazon prime video psychedelic sci fi with jane fonda ,,AmazonPrimeVideo,watched barbarella from on amazon prime video psychedelic sci fi with jane fonda  
will amazon charge for days trial prime video on my credit card when i add it ,,AmazonPrimeVideo,will amazon charge for days trial prime video on my credit card when i add it  
how to view a prime channel s full library ,,AmazonPrimeVideo,how to view a prime channel s full library  
there is a youtub r all d le n far d y th t l rns ev ryweek a new skill is r l tiv s ass d way when h w s h makes vid os bout wn xp rience of m st ring new skills nd anoth r vid os f r people t k ep motiv ti n to le rn and try new things b aus we have nly on lif ,,AmazonPrimeVideo,there is a youtub r all d le n far d y th t l rns ev ryweek a new skill is r l tiv s ass d way when h w s h makes vid os bout wn xp rience of m st ring new skills nd anoth r vid os f r people t k ep motiv ti n to le rn and try new things b aus we have nly on lif  
indian prime video users ,i come in good faith as much as we love this subreddit of our favorite ott prime video a lot of content here isn t available in india like we don t have live channel renting of content no live sports and a lot of amazon content in western countries is on netflix in india i m kindly requesting mods to allow me to solicit indian users of amazon prime videoany indians who wish to join are more than welcome to this new sister subreddit for your indian brothers pertaining only to updates regarding the ott in the subcontinent r amazonprimevideoins wwwredditcom r amazonprimevideoin utm medium android app amp utm source share,AmazonPrimeVideo,indian prime video users  i come in good faith as much as we love this subreddit of our favorite ott prime video a lot of content here isn t available in india like we don t have live channel renting of content no live sports and a lot of amazon content in western countries is on netflix in india i m kindly requesting mods to allow me to solicit indian users of amazon prime videoany indians who wish to join are more than welcome to this new sister subreddit for your indian brothers pertaining only to updates regarding the ott in the subcontinent r amazonprimevideoins wwwredditcom r amazonprimevideoin utm medium android app amp utm source share
commercials during episodes,,AmazonPrimeVideo,commercials during episodes 
amazon prime got only sci fi movies ,,AmazonPrimeVideo,amazon prime got only sci fi movies  
musical theatre fans what should i watch included on prime ,,AmazonPrimeVideo,musical theatre fans what should i watch included on prime  
should i cancel or can you guys help me appreciate prime better ,,AmazonPrimeVideo,should i cancel or can you guys help me appreciate prime better  
rant decided to cancel prime please change my mind if you have good recommendations,,AmazonPrimeVideo,rant decided to cancel prime please change my mind if you have good recommendations 
missing buy season options for random show volumes,,AmazonPrimeVideo,missing buy season options for random show volumes 
watched the towering inferno from on amazon prime video great cast one of the best disaster films,,AmazonPrimeVideo,watched the towering inferno from on amazon prime video great cast one of the best disaster films 
the family man season official trailer raj amp dk manoj bajpayee samantha amazon original,,AmazonPrimeVideo,the family man season official trailer raj amp dk manoj bajpayee samantha amazon original 
how to watch shows in ,,AmazonPrimeVideo,how to watch shows in  
solos,any early reviews for the seriesi didn t get time today probably will start watching by tomorrow,AmazonPrimeVideo,solos any early reviews for the seriesi didn t get time today probably will start watching by tomorrow
unable to stream hd or hdr content on prime mobile app,,AmazonPrimeVideo,unable to stream hd or hdr content on prime mobile app 
can you use amazon gift card for prime video rentals ,,AmazonPrimeVideo,can you use amazon gift card for prime video rentals  
 wheel of time renewed for season at amazon as season wraps production,,AmazonPrimeVideo, wheel of time renewed for season at amazon as season wraps production 
everybody s talking about jamie skips theaters and debuts on amazon prime video on september ,,AmazonPrimeVideo,everybody s talking about jamie skips theaters and debuts on amazon prime video on september  
is invincible not available in full hd on amazon prime ,hi it seems like it s the only series that doesn t work in full hd in my computer while other ones do fine,AmazonPrimeVideo,is invincible not available in full hd on amazon prime  hi it seems like it s the only series that doesn t work in full hd in my computer while other ones do fine
my review of invincible,,AmazonPrimeVideo,my review of invincible 
watched the ladykillers from on amazon prime video great cast funny flick from the cohen brothers,,AmazonPrimeVideo,watched the ladykillers from on amazon prime video great cast funny flick from the cohen brothers 
am set for months s wwwtk ,,AmazonPrimeVideo,am set for months s wwwtk  
chromecast app issues,,AmazonPrimeVideo,chromecast app issues 
how the fuck do i turn off x ray on the app it keeps spoiling shit,,AmazonPrimeVideo,how the fuck do i turn off x ray on the app it keeps spoiling shit 
the collection season ,i just watched season of the collection and honestly i love it why hasn t amazon renewed their contract i hate it when good shows stop with cliffhangers ughh ,AmazonPrimeVideo,the collection season  i just watched season of the collection and honestly i love it why hasn t amazon renewed their contract i hate it when good shows stop with cliffhangers ughh 
skinwalker ranch removed in canada,just weeks ago i was watching skinwalker ranch and i wanted to watch it again it s now unavailable i am upset and annoyed because i was really enjoying the show and it s not like the company moved to a different company or it got less popular so why does this happen ,AmazonPrimeVideo,skinwalker ranch removed in canada just weeks ago i was watching skinwalker ranch and i wanted to watch it again it s now unavailable i am upset and annoyed because i was really enjoying the show and it s not like the company moved to a different company or it got less popular so why does this happen 
amazon said to make billion offer for mgm,,AmazonPrimeVideo,amazon said to make billion offer for mgm 
watched at close range from great cast really good flick ,,AmazonPrimeVideo,watched at close range from great cast really good flick  
 movies not playing in ,,AmazonPrimeVideo, movies not playing in  
amazon india launches amazon minitv in india ,,AmazonPrimeVideo,amazon india launches amazon minitv in india  
hi,,AmazonPrimeVideo,hi 
for anyone on the fence about yellowstone just give it episodes i ve been putting it off for months one of the best shows i ve seen in my life,,AmazonPrimeVideo,for anyone on the fence about yellowstone just give it episodes i ve been putting it off for months one of the best shows i ve seen in my life 
wayne doesn t show up in search results canada ,,AmazonPrimeVideo,wayne doesn t show up in search results canada  
wayne doesn t show up in search results canada ,,AmazonPrimeVideo,wayne doesn t show up in search results canada  
why and how why is it here and how do you get rid of this dumb grey bar around the left and top of the screen full screen doesn t do anything,,AmazonPrimeVideo,why and how why is it here and how do you get rid of this dumb grey bar around the left and top of the screen full screen doesn t do anything 
