subreddit,title_text_lem
netflix,sandman netflix series add cast including kirby howell baptiste patton oswalt stephen fry
netflix,netflix sandman cast revealed
netflix,sorry could reach netflix service please try later
netflix,join brand new three body problem discord
netflix,someone give movie
netflix,hello everyone talking selling netflix account shoppy come see pre account cheap come check first costumer get discount use coupon
netflix,ok netflix ok take time
netflix,movie greatness watched movie day thought great one thing figure part farmer funeral seems like biblical reference anyone give input
netflix,youtube
netflix,silence official trailer netflix ai upscale
netflix,stranger thing eleven listening netflix ai upscale
netflix,ringing buzzing noise netflix window app week ago noticed ringing buzzing high pitched noise watching netflix window app especially noticeable netflix intro screen background music playing movie web version problem neither device tried updating driver playing around audio setting deleting reinstalling app seem go away anyone problem managed find solution
netflix,need help trying find old movie
netflix,netflix higher bitrate stream quality tier know netflix hd stream esp hdr dolby vision heavily compressed really justice format capability acute large high end tv surround system high speed connectionsit evident netflix unlikely increase bitrates even match apple disney amazon due cost reason current tier subscriber base large many would interested higher priced tier offered much high quality stream video audio quality rival better apple disney etc one would jump especially quality improvement substantial got close possible physical medium
netflix,watching girl dragon tattoo right poor quality like yet switch another movie nice clear hd going
netflix,girl nowhere amazed blown scared finishing showhad crazy nightmare show especially watching season last ep really something never saw comingreally hope season
netflix,love death robot season worth watch
netflix,watched dance wolf netflix great flick ton award
netflix,anyone know kung fu panda coming back u know movie got added back july week got removed completely still one favorite dreamworks movie enjoyed happy added sequel month back sadly got removed wellso wondering anyone know kung fu panda come back netflix soon thanks guy also time newcomer lol
netflix,best thriller movie show netflix
netflix,bring back xbox party
netflix,community recently learned netflix refuse play episode favourite show annoyed pirate watch episode actor ken jeong dress night elf make joke racist emailed company complaint asking fan show well silly netflix movie scantily clad child twerking reason draw line
netflix,amazon nears deal buy mgm studio nearly billion
netflix,anyone else uk issue
netflix,please fix shitty app window reason yearly limit download per year applies episode never even watched downloaded downloaded episode onto laptop find none work netflix recommends redownloading episode fine guess reached yearly limit download per episode whatefuck
netflix,bingeable comedy show
netflix,need help
netflix,evidence piling netflix want netflix game
netflix,sony bdv option netflix used get show
netflix,startup startup introduce cryptocurrencies dark web mostly action take succeed would willing accept money people trust three main partner come different background drive behavior think deserves season check full review feel free join discussion bingeworthycrowdstackapp p startup
netflix,army dead going time loop theory robot zombie
netflix,turk mixed amv
netflix,gunpowder milkshake official trailer
netflix,moved country netflix think using vpn
netflix,selling cheap netflix account hulu account disneyplus account crunchyroll account spotify account xbox account game account game account u may want u decide price dm
netflix,selling cheap netflix account hulu account disneyplus account crunchyroll account spotify account nord vpn account xbox account game account game account u may want u decide price dm
netflix,r thelastairbender begin new viewer friendly watch avatar tla june
netflix,army dead
netflix,netflix always judders left show use vivaldi browser never used problem cleared history multiple time logged back etcbut show done left red bar picture judders slows second loading showing else advance anyone else kind break immersion end watching something know show minute left
netflix,poor netflix quality
netflix,bad netflix quality
AmazonPrimeVideo,stack tv subscriber
AmazonPrimeVideo,chromecast
AmazonPrimeVideo,using digital reward credit channel subscription got digital reward rush shipping expire soon wondered could use toward premium channel like paramount
AmazonPrimeVideo,infinite loading ad
AmazonPrimeVideo,infinite loading screen whenever ad try load
AmazonPrimeVideo,anyone know time clarkson farm prime hi anyone know time uk est clarkson farm available stream
AmazonPrimeVideo,confused bit confused watching yugioh duel monster say season included imdbtv click episode season however still let watch
AmazonPrimeVideo,channel subscription include content streaming channel offer rewatching mythbusters series subscribed discovery prime video friend subscribed directly discovery access season included try watch prime channel subscription amazon asks pay episode seems wrong
AmazonPrimeVideo,mixed feeling family man season ending season setup
AmazonPrimeVideo,creepiest movie childhood prime video called adventure mark twain claymation film remembered freaked kid thought see freaky remember oh boy ever want watch whole thing scariest part start minute mark
AmazonPrimeVideo,great spy series family man
AmazonPrimeVideo,watched knowing amazon prime video fun sci fi thriller nicolas cage
AmazonPrimeVideo,g
AmazonPrimeVideo,indiana jones
AmazonPrimeVideo,recommendation
AmazonPrimeVideo,boy season first look jensen ackles soldier boy cinemablind
AmazonPrimeVideo,brainwashing bad wild
AmazonPrimeVideo,boy first look jensen ackles soldier boy
AmazonPrimeVideo,major website including ny time cnn amazon amp hour long outage due server issue
AmazonPrimeVideo,debate invincible boy
AmazonPrimeVideo,trying help folk favorite type show hgtv diy network travel show recommendation category help customize prime recommends
AmazonPrimeVideo,cast
AmazonPrimeVideo,cast
AmazonPrimeVideo,amazon prime video redesigned layout sort worse
AmazonPrimeVideo,family man review
AmazonPrimeVideo,watched killer elite amazon prime video great cast first american movie feature ninja
AmazonPrimeVideo,way buy movie series instead one time several movie series rather enjoy getting prime account seem available purchase one time sort option buy whole set instead getting one one like used buy dvd box set instead individual dvd
AmazonPrimeVideo,family man season
AmazonPrimeVideo,dark shadow beginning almost included prime included prime dark shadow beginning season included prime say description wwwamazoncom gp video detail ref episode season buy episode season sd option skip ep watch ep rest without purchase included prime false advertising say season included prime selected episode
AmazonPrimeVideo,changing audio subtitle one device picking movie series another one keep one selected content save one device
AmazonPrimeVideo,hannibal one favourite show think pretty underrated gore freak recommend masterpiece fun
AmazonPrimeVideo,film amazon constantly dropping moment back help
AmazonPrimeVideo,watched sixth sense amazon prime video great horror thriller night shyamalan
AmazonPrimeVideo,watch amazon prime netflix friend
AmazonPrimeVideo,prime hbo max anyone know prime offer choice either tier tier getting prime hbo max looking hbo schedule list movie supported tier hbo max prime tier
AmazonPrimeVideo,imbtv seemingly overriding subscription
AmazonPrimeVideo,prime video slap pay wall back video supposed included prime check detail
AmazonPrimeVideo,one day time alum justina machado star amazon pilot horror dolores roach roxann dawson direct
AmazonPrimeVideo,bosch season official trailer
AmazonPrimeVideo,different video selection different device
AmazonPrimeVideo,find english version naruto canada find english sub dub version naruto naruto related show even know written french prime video language set english way fix processing img
AmazonPrimeVideo,mary j blige life official trailer prime video
AmazonPrimeVideo,producer amazon prisma twin challenge gender norm
AmazonPrimeVideo,prime video skipping episode season new prime video im watching office always press next episode today find selecting episode list least half episode three season skipped resumed today said season whole season skipped didnt finished third yet wtf bug anyone experienced annoying realized skipped soo many episode im mad rn
AmazonPrimeVideo,prime video skipping episode season
AmazonPrimeVideo,tried get free trial got charged
AmazonPrimeVideo,adjust amazon prime video quality resolution using google chromecast
AmazonPrimeVideo,high level region locking
AmazonPrimeVideo,new release came prime video may
AmazonPrimeVideo,time film tend released prime britain waiting new saw film spiral released prime according google released tomorrow wondering time film likely available assuming course google correct release date streaming service thanks advance
AmazonPrimeVideo,apps think different country
AmazonPrimeVideo,apps think different country
AmazonPrimeVideo,amazon mgm mega deal movie tv show
AmazonPrimeVideo,amul indian diary company celebrates amazon mgm deal
AmazonPrimeVideo,anybody else prime video app show amazon original anyone know fix
AmazonPrimeVideo,help download video downloads different language watch online back english
AmazonPrimeVideo,zabardastzindabadamazing
AmazonPrimeVideo,amazon prime video quality incredibly bad
AmazonPrimeVideo,amazon prime video quality incredibly bad
AmazonPrimeVideo,wild dog villain entry bgm prathish keyboard
AmazonPrimeVideo,watch subscribed
AmazonPrimeVideo,watch subscribed
AmazonPrimeVideo,space odyssey available prime video
AmazonPrimeVideo,watched world greatest dad amazon prime video good flick robin williams great directed bobcat goldthwait
AmazonPrimeVideo,quiet place available watch prime video tomorrow
AmazonPrimeVideo,indie film maker
AmazonPrimeVideo,save amazon save world
AmazonPrimeVideo,ad throughout prime video anyone else seen ad placed throughout prime video recent minute ad placed throughout prime content never happened think may testing see customer complain make permanent mind paying extra ad free experience introduce without notification seems shady
AmazonPrimeVideo,watched angel heart amazon prime video great flick good cast fun thriller
AmazonPrimeVideo,amazon buy mgm studio billion
AmazonPrimeVideo,amazon buy mgm studio behind james bond billion
AmazonPrimeVideo,amazon series adaptation expatriate cast ji young yoo
AmazonPrimeVideo,amazon said near deal buy mgm billion report
AmazonPrimeVideo,coming amazon prime imdb tv june
AmazonPrimeVideo,possible share prime video account someone live watch time need help greatly appreciated
AmazonPrimeVideo,solo amazon prime ending explained review recap amp breakdown solo
AmazonPrimeVideo,anyone watched solo character episode linked previous episode character seem figure tom epi related leah epi somebody pls help xd
AmazonPrimeVideo,video quality god awful using chrome window btw pretty sure fault youtube pretty sharp internet connection strong
AmazonPrimeVideo,anime dutch prime video anime dutch prime video show want watch available prime video available netherlands available country like germany usa anybody know going change
AmazonPrimeVideo,watched barbarella amazon prime video psychedelic sci fi jane fonda
AmazonPrimeVideo,amazon charge day trial prime video credit card add
AmazonPrimeVideo,view prime channel full library
AmazonPrimeVideo,youtub r le n far th l rn ev ryweek new skill r l tiv as way h w h make vid o bout wn xp rience st ring new skill nd anoth r vid o f r people k ep motiv ti n le rn try new thing b au nly lif
AmazonPrimeVideo,indian prime video user come good faith much love subreddit favorite ott prime video lot content available india like live channel renting content live sport lot amazon content western country netflix india kindly requesting mod allow solicit indian user amazon prime videoany indian wish join welcome new sister subreddit indian brother pertaining update regarding ott subcontinent r amazonprimevideoins wwwredditcom r amazonprimevideoin utm medium android app amp utm source share
AmazonPrimeVideo,commercial episode
AmazonPrimeVideo,amazon prime got sci fi movie
AmazonPrimeVideo,musical theatre fan watch included prime
AmazonPrimeVideo,cancel guy help appreciate prime better
AmazonPrimeVideo,rant decided cancel prime please change mind good recommendation
AmazonPrimeVideo,missing buy season option random show volume
AmazonPrimeVideo,watched towering inferno amazon prime video great cast one best disaster film
AmazonPrimeVideo,family man season official trailer raj amp dk manoj bajpayee samantha amazon original
AmazonPrimeVideo,watch show
AmazonPrimeVideo,solo early review seriesi get time today probably start watching tomorrow
AmazonPrimeVideo,unable stream hd hdr content prime mobile app
AmazonPrimeVideo,use amazon gift card prime video rental
AmazonPrimeVideo,wheel time renewed season amazon season wrap production
AmazonPrimeVideo,everybody talking jamie skip theater debut amazon prime video september
AmazonPrimeVideo,invincible available full hd amazon prime hi seems like series work full hd computer one fine
AmazonPrimeVideo,review invincible
AmazonPrimeVideo,watched ladykillers amazon prime video great cast funny flick cohen brother
AmazonPrimeVideo,set month wwwtk
AmazonPrimeVideo,chromecast app issue
AmazonPrimeVideo,fuck turn x ray app keep spoiling shit
AmazonPrimeVideo,collection season watched season collection honestly love amazon renewed contract hate good show stop cliffhanger ughh
AmazonPrimeVideo,skinwalker ranch removed canada week ago watching skinwalker ranch wanted watch unavailable upset annoyed really enjoying show like company moved different company got le popular happen
AmazonPrimeVideo,amazon said make billion offer mgm
AmazonPrimeVideo,watched close range great cast really good flick
AmazonPrimeVideo,movie playing
AmazonPrimeVideo,amazon india launch amazon minitv india
AmazonPrimeVideo,hi
AmazonPrimeVideo,anyone fence yellowstone give episode putting month one best show seen life
AmazonPrimeVideo,wayne show search result canada
AmazonPrimeVideo,wayne show search result canada
AmazonPrimeVideo,get rid dumb grey bar around left top screen full screen anything
AmazonPrimeVideo,thank screen rant spoiling ending two great anti superman story reason warning read peril
AmazonPrimeVideo,search function broken movie access direct link get justwatch show use search barthe office literally show front page use search bar lol even search actor like steve carrell show
AmazonPrimeVideo,monkey season
AmazonPrimeVideo,invincible gore compilation
AmazonPrimeVideo,made simple python program give power automatically press skip intro button soon appears without interaction assign hotkey
AmazonPrimeVideo,hide
AmazonPrimeVideo,watched tenant great horror flick man rent apartment woman committed suicide slip slowly madness
AmazonPrimeVideo,language subtitle menu pop android
AmazonPrimeVideo,retirement home doc portugal passion pain group elder sharing building every weekday
AmazonPrimeVideo,bosch season trailer release date amp know far
AmazonPrimeVideo,severe lack caption subtitle world wide thing
AmazonPrimeVideo,language sub icon working android
AmazonPrimeVideo,los colores de colombia boy medell n prime video
AmazonPrimeVideo,bosch season official teaser prime video
AmazonPrimeVideo,true royalty tv launch amazon prime video channel u
AmazonPrimeVideo,amazon eye fall date recent cinderella camila cabello acquisition
AmazonPrimeVideo,underground railroad tv review barry jenkins adaptation brilliant
AmazonPrimeVideo,jeff blackburn return amazon oversee medium amp entertainment operation
AmazonPrimeVideo,wireguard vpn working showing content region
AmazonPrimeVideo,access info episode movie
AmazonPrimeVideo,gone
AmazonPrimeVideo,panic official trailer prime video
AmazonPrimeVideo,pink know far official trailer prime video
AmazonPrimeVideo,banker wife series scrapped amazon
AmazonPrimeVideo,russell wilson ciara ink first look film tv deal amazon
AmazonPrimeVideo,amazon acquires valor jeff chan amp andrew rhymer producing
AmazonPrimeVideo,lightyears five series regular added cast amazon series
AmazonPrimeVideo,access info episode movie
AmazonPrimeVideo,anyone know choose audio option downloaded show movie
AmazonPrimeVideo,join u r solostv subreddit new show streaming prime video may
AmazonPrimeVideo,watched joe great peter boyle joe hippie hating racist befriends right wing executive take violent action gritty raw movie includes susan sarandon film debut
AmazonPrimeVideo,russell wilson ciara ink first look film tv deal amazon
AmazonPrimeVideo,counterfeiter quiet love
AmazonPrimeVideo,without remorse operation drone drop prime video
AmazonPrimeVideo,solo trailer prime video
AmazonPrimeVideo,dom official trailer prime video
AmazonPrimeVideo,english emily blunt chaske spencer cast bbc amp amazon series
AmazonPrimeVideo,watch cracka amazon series called cracka let watch anyone know anywhere else watch series
AmazonPrimeVideo,take away original dub
AmazonPrimeVideo,heck ad
AmazonPrimeVideo,watched almost famous amazon prime video great flick semi autobiographical story teenage rock journalist written directed cameron crowe
AmazonPrimeVideo,way disable next episode thing end even autoplay turned small box bottom corner still pop option disable
AmazonPrimeVideo,invincible big deal
AmazonPrimeVideo,zoom feature android app badly optimized
AmazonPrimeVideo,series naoki urusawas monster working
AmazonPrimeVideo,watched max amazon prime video really interesting flick young hitler relationship jewish art dealer
AmazonPrimeVideo,prime video hd desktop
AmazonPrimeVideo,watched harry brown amazon prime video great flick kind present day death wish
AmazonPrimeVideo,get anime english dub please
AmazonPrimeVideo,technologywhich streaming service subscription
AmazonPrimeVideo,amazon think speak french live belgium absolutely love amazon streaming catalog earth catalog available french often even even originally spoken english either nope dubbed subbed french
AmazonPrimeVideo,help
AmazonPrimeVideo,honestly amazon video trash worth always used netflix tried amazon video series invincible feel like good content anything else bad bad review making even start itthis trillion dollar company better content make better content c mon watching boy right finishing season plan go onif movie show generally good found elsewhere without needing pay primeamazon need game see lasting amazon prime user
AmazonPrimeVideo,handmaid tale season streaming prime video india
AmazonPrimeVideo,earth get episode list
AmazonPrimeVideo,leverage redemption unveils teaser trailer premiere date
AmazonPrimeVideo,twitch nfl amp imdb tv push amazon monthly ad supported streaming viewer january
AmazonPrimeVideo,michael b jordan without remorse draw household first amazon weekend
AmazonPrimeVideo,watched strange love martha ivers amazon prime video great cast great old flick
AmazonPrimeVideo,friend mine watch several show free pay office park rec house md example would buy every season order watch watch free could causing
AmazonPrimeVideo,unable open prime video app android common problem keep getting message
AmazonPrimeVideo,tom clancy ryanverse
AmazonPrimeVideo,hey guy put together spoiler free review show wayne really want people watch get season looking new show please give shot
AmazonPrimeVideo,global content search multiple website like unogs netflix check availability title per countriesare tool website similar prime video get know title availability per region
AmazonPrimeVideo,android app working android tv
AmazonPrimeVideo,horrible quality
AmazonPrimeVideo,amazon earnings explode streaming hour rise year year
AmazonPrimeVideo,invincible really come season finale review
AmazonPrimeVideo,stream download
AmazonPrimeVideo,download stream
AmazonPrimeVideo,watchlist new update well got new fw update couple day ago wanted join watchlist wth watchlist menu enter heck
AmazonPrimeVideo,jk simmons join sissy spacek amazon sci fi series lightyears ed neill exit
AmazonPrimeVideo,alien abduction
AmazonPrimeVideo,season finale review
AmazonPrimeVideo,summer turned pretty series amazon set four lead role
AmazonPrimeVideo,amazon ya pilot hot pink add five cast
AmazonPrimeVideo,invincible renewed season amazon
AmazonPrimeVideo,anyone know time tom clancy without remorse show prime video stream united state assuming est mean available earlier west coast
AmazonPrimeVideo,love jeff bezos
AmazonPrimeVideo,dom teaser trailer rio de janeiro
AmazonPrimeVideo,turn autoplay preview
AmazonPrimeVideo,tomorrow war teaser amp everything know far
AmazonPrimeVideo,anybody know season magician available netherlands watch season
AmazonPrimeVideo,use watch party feature reason everytime girlfriend creates watch party sends link click link get redirected join party page instead get redirected title get prompted message watch party unavailable location thing happens send link live location prime membership idk use
AmazonPrimeVideo,recently started using prime video beginning app tv english bought something amazonde pc tv app switched german language two option language setting spanish german could really use help thank good people
AmazonPrimeVideo,second ad break good morning pb add package watching lidia italian american kitchen prime video morning got three second ad break watching unlike hulu ad something new missed prime showing ad everything expensive want know something consider subscription renews thanks
AmazonPrimeVideo,second ad break
AmazonPrimeVideo,change prime video profile photo
AmazonPrimeVideo,need dislike button
AmazonPrimeVideo,see movie apv android app pc web browser example see movie bloodshot appear amazon prime video app start watching without problem pc movie even appear even searched live denmarkhow even possible anybody else experience
AmazonPrimeVideo,congratulation sound metal
AmazonPrimeVideo,hd unavailable lot movie
AmazonPrimeVideo,fire stick new dashboard turn autoplay trailer good news anyway turn annoying auto playing trailer setting gt preference gt featured contentin prime app mute unfortunately prime app setting hope help someonei know people like least option
AmazonPrimeVideo,turn translation im currently watching expanse there really annoying thing going ive never happen beforeso whenever writing onscreen computer display name location change setting come subtitle box translating whatever onscreen germanno idea subtitle turned set english anyway audio amp language also set englishits massive problem bit immersion breaking often translation cover actual writing cant read location date scene meant set
AmazonPrimeVideo,watched episode minute later became unavailable next day still unavailable idea
AmazonPrimeVideo,amazon prime video internacional dispositivos ebay
AmazonPrimeVideo,watched line fire clint eastwood best excellent cast good flick
AmazonPrimeVideo,movie tv show coming amazon prime video may
AmazonPrimeVideo,batman death family stacked tv minute long found batman death family amazon prime get stacked tv movie minute long show actual stuff went movie within movie get going anyone watch movie tell bunch short
AmazonPrimeVideo,wentworth anything like watch near end series already withdrawal
AmazonPrimeVideo,episode invincible far loving show episode best episode far insane action internal family drama show keeping engaged foot edge ready see go next enjoy
AmazonPrimeVideo,lighting supposed look like confusing nobody else talking weird filter tv issue cant tell tv show
AmazonPrimeVideo,anybody found subreddit show
AmazonPrimeVideo,step movie available purchase amazon prime wwwstepsthemovieinfo
AmazonPrimeVideo,prime video sort dynamic contrast adjustment
AmazonPrimeVideo,subtitle stay freeze
AmazonPrimeVideo,westworld amp money heist star lead amazon explorer series boundless director simon west
AmazonPrimeVideo,hi wondering someone watched show could tell dog ever get hurt like prepare beforehand lol
AmazonPrimeVideo,keep happening kid profile watch episode show bamthis show u kid profilewatching kid show help prime year suddenly happening
AmazonPrimeVideo,terrible video quality morning woke awesome idea rewatch expanse reason streaming quality absolutely garbage morning oled finished expanse already along many prime show know hdr look like reason swear quality even like mean like impossible watch video terrible audio think tried different season quality tried completely different show thing reason quality across amazon prime video absolutely terrible morning anyone else experiencing happening device network
AmazonPrimeVideo,terrible quality morning
AmazonPrimeVideo,best show completed last season long comedy amp since taken time watch good tv show would appreciate something good story amp best show find prime finished old matter last leg
AmazonPrimeVideo,serious question hulu disney amazon prime video hulu ad disney month find much disney watch least already seen purchase little amazon month could get amazon prime anyways real question watch amazon prime video stuff opinion much included prime stuff concerned
AmazonPrimeVideo,stuck free trial page
AmazonPrimeVideo,stuck free trial main page
AmazonPrimeVideo,listen truth told car important house ask cause sleep car baby drive house around
AmazonPrimeVideo,car important house sleep car baby drive house around listen truth told car important house ask cause sleep car baby drive house around
