subreddit,title_text_lem
netflix,heman
netflix,help find episode looking something saw many year ago think may fringe tv show know surethere serial killer kidnapping killing woman hair turning hair bow string violinist big performance coming wanted best bow could get trying different hair colour memory something like strawberry blonde liked orange hair tends lot thicker wanted one coarseanyways swear real thing family believe trying find itthank advance help give
netflix,netflix work noticed netflix refuse launch surface laptop well apple tv also happens trying get netflix site browser use mobile data hotspot connect going week really appreciate anyone could help figure way fix thank
netflix,army dead army dead set new york city month event first film instead viva la vega opening song theme new york frank sinatra
netflix,believe abduction lisa mcvey sorry little rant holy shit female police officer useless piece human waste ever seen mean god sake thought least would believe movie infuriating turn got annoyed obvious going holy crap needed break make sick
netflix,new auto skip intro addon chrome new design old skip intro addon longer work unknown reason netflix continues add quality life fix
netflix,bridgrton quiz
netflix,cannot resume unpause playback netflix mobile app good evening r netflixas title state issue play button playback mobile app android device pausing play button respond tried reach netflix avail time treated basic end user sent article troubleshooting streaming issue android device performed step multiple time dont want reach netflix time ask guidance even acknowledgement one dealing device samsung galaxy galaxy current version android netflix let know info need tiarespectfully boogy
netflix,netflix skater girl reflects life india skateboarding girl
netflix,need help netflix lover
netflix,netflix movie bad get wrong hit love monster great horrible trash movie releasing watched awake probably one worse movie ever seen
netflix,black hole edge know
netflix,need help netflix lover
netflix,fresh fried crisp love wanderer food show one special fried food done right amazing done wrong depressing kind gross slo mo bite take asmr mic crunch whatever damn take camera mouth
netflix,netflix parental control
netflix,anyone show movie drama crime documentary
netflix,disable create profile netflix
netflix,thing good netflix thinking canceling subscription
netflix,time mac app offline viewing got macbook air month ago really excited impression would able use ipad netflix app download video offline viewing plane stuff turn developer choose allow ipad app downloads new mac despite app fully capable running get interface would different would kink work still problem deal witheven ipad app answer still think app window android io ipados fire tablet even chromebooks even take much effort build ipad app build app seems annoying odd point deliberate still option despite available every mobile devicei also point nearly streaming service took apps well hulu disney either also understand netflix alone know day mac dropping people able download ipad app run later netflix removed app store removed able manually install ipad app mac limited understanding somehow blocked well want offline viewing inch screen plane without buy ipad pro well
netflix,anyone explain bizarre aspect ratio poseidon netflix problem netflix content bit annoying look take film
netflix,netflix announces new anime spinoff bright samurai soul
netflix,axolotl finance claim axo minute
netflix,started watching trese honestly know think like really know concept cool writing bitplain character engaging main character bit boring special ability normal tragic backstory powerful main hero thing without certain twistit like people story even invoke emotion loved castevania fantasy general said know oneanyone concrete answer also damn thing play originally filipino think one u everyone either hispanic filippino play mexico
netflix,looking someone make cum add kik
netflix,coming netflix july
netflix,anyone know good movie removed netflix uk netflix uk lot good movie particular seem getting phased fro apparent reason listed dumb dumber dumber dumber truman show evan almighty white collar star jim carrey favourite actor assume licensing issue something behind scene expired changed since addition netflixanyone know going netflix good show seems like nothing watch anymore
netflix,get rid full page ad downloads want set feature every time go downloads page full page ad trying get set make go away
netflix,witcher game netflix series making new plan july
netflix,seems netflix ninja ed cut tie stream party teleparty guy experiencing want watch netflix friend netflix ninja update man u pissed lol
netflix,help
netflix,seems netflix ninja ed cut tie stream party teleparty
netflix,assista ao primeiro teaser jogo cuphead da netflix
netflix,black summer season recap new season black summer coming soon let talk season ton thing got nerve season like everyone aim bad kill character quick easy like ryan william straight murdered show good watched season going watch season say two favorite character lance sun hope kill like william william basically sprained foot put dumb
netflix,reality contest picture spoiler tired getting spoiler always show winner season poster recently watched glow next fashion need know win get go take away part magic wish general picture like thegreat british baking show anyone else annoyed
netflix,lance reddick headline resident evil netflix show albert wesker
netflix,lance reddick headline resident evil netflix show albert wesker
netflix,lance reddick headline resident evil netflix show albert wesker
netflix,far cry anime series set netflix streamer pick adi shankar captain laserhawk blood dragon remix
netflix,hehe
netflix,error android
netflix,arcane animated series score settle
netflix,netflix release official first look witcher season trailer
netflix,cd projekt red netflix announce witchercon july
netflix,geekiest show still bumming
netflix,cuphead show w wayne brady king dice geeked sneak peek netflix
netflix,cuphead show w wayne brady king dice geeked sneak peek netflix
netflix,random movie amp serie picker bored evening try brand new application discover new movie amp series watch tonightwith one button click discover movie amp serie many genre amp filtersevery movie amp serie list provider region watch netflix amazon hbogotry gt playgooglecom store apps detail id comrandom movie series picker previewreddit png width amp format png amp auto webp amp
netflix,sound design new arcanum trailer crazy good one first thing stood dearly hope stay high quality entire series sound design one important part piece medium aracana seems deliver slight crunching glass underneath jinx boot walk building stylized whoosh whenever jinx twirl gun shunk machinery fitting place sound hyperrealistic attention detail astonishing segment jinx putting boxing machine back together part activated sounded near orgasmic expected arcanum sound design every steampunk show lot clicking whistle steam make machine arguably important part steampunk story audibly boring exhausting listen long glad see show runner able produce excellent quality sound
netflix,captain laserhawk looking good
netflix,castlevania new series starring richter belmont son sypha trevor maria renard set france french revolution currently work
netflix,wish dragon review netflix sony animation take aladdin contemporary china mature beautiful
netflix,everything fine
netflix,look cast plot trailer release date everything need know
netflix,parody recap netflix sweet tooth
netflix,help movie title young woman joining anti fascist militia hey india saw movie titled soon woman joining antifascist militia nad spiraling violence find movie would appreciate help getting name
netflix,netflix movie bit rant kid movie netflix non existant fine series series getting nerve movie section logged netflix kid account countless title single one moviethey loose episode show minute episode little monster movie minute lego spiderman story moviethe best minute long episode something like dragon rescue rider movie long episode showwe trying make friday family movie night netflix absolutely useless
netflix,awake netflix really dark picture
netflix,downloaded title showing need help hi everyone going vacation soon thought use netflix download downloaded episode show episode showing downloads click view episode take main screen show able see rest downloads problem need wifi view episode vacation anyone know solve issue get downloads show downloads tried restarting app work thanks advance
netflix,happened leaving soon feature list anyone know happened feature would tell movie list leave netflix used show week movie scheduled leave looked list desktop laptop disappeared couple month ago way get back helpful
netflix,english show movie start speaking like italian subtitle say speaking italian figure saying watching godfather one big scene speaking italian clue saying setting make right audio english subtitle english
netflix,selena writer say netflix series disrespected singer staff
netflix,note comment upvote inbox cash prize allow mention single name
netflix,free netflix account
netflix,song bo burnham inside finally spotify
netflix,want get cheaper
netflix,one doesnt like izzie casey atypical honestly think relationship kinda toxic izzie kissing another guy stuff hating evan real badthere might stuff cant remember since watched series month agocasey evan moment really loved evan would casey stuffthis opinion im hating
netflix,trese masterpiece making anyone watching right satisfaction meter going nut right new show beautifully made love know people taking lately come stay away thing marked n mysome team netflix put money right project please watch series gem skip intro credit even
netflix,cialis tablet price pakistan cialis needed use cialis also used needed men approach often use higher potency tablet high potency mean effect last much longer conventional ed drug
netflix,awake barry pepper pastor netflix review
netflix,show suggestion
netflix,graphic text issue rewatching met mother noticed whenever text graphic show come subtitle well designed graphic screen example season episode wedding bride ted watch wedding bride cinema title movie supposed come nyc background instead background shown title movie come subtitle text minute second imagine something translating language seriously poor take viewing experience went disney see happened nope disney normal graphic usedwondering anyone else seen across show film context watching new zealand
netflix,new song latest english song pop music new song english song metubeonline
netflix,netflix man master universe reaction discussion anime v animation man fan mixed review
netflix,trese look cheaply done
netflix,philip pondering perception trese
netflix,could difficult find prince harry star crown
netflix,philip pondering perception woman window late review watched trailer pandemic fault set expectation high film trailer really misleading sometimes watched immediately upon release found pace quite slow scene unnecessary aftereffect reshoots probably amy adam spectacular though plot impressive
netflix,queer eye cast faced blatant hate filming texas
netflix,someone pls help ok idk even fixable im dominican vacation downloaded couple season naruto flight left state case phone work netflix somewhere else idk like binged watched downloaded season new season try download watch spanish cell provider name like changed corner phone something spanish idek shit even mean phone provider mobile sprint wondering fix anyone experienced huge deal hooked naruto shit annoying breaking bad english never downloaded episode breaking bad
netflix,series changed vision see world like billion example lot one little experience im looking series work mind creativety certain way inspire motivate recommendation changed way see world word really interesting series
netflix,help screen black sound xbox series ever since got series console seem stream movie netflix original watch tv show fine watch like shutter island spiderman see second movie screen go black hear movie anyone else experienced
netflix,comedy show recommendation
netflix,awake holy moly writing thing terrible even finish watching yet protagonist randomly saying one sleep without context son asking guy burst door boyfriend wrote piece trash
netflix,four year old asked added slot netflix countdown unsee
netflix,power ranger dino fury coming netflix june episode exclusively available streaming service month air tv source
netflix,hidden gem show enjoy netflix seeing quite post recommendation highly known famous title thought hidden gem show list might helpfulall mine netflix u rilakkuma kaoru japanese stop motion animation show woman life stuffed bear diagnosis docuseries writer new york time crowd source medical diagnosis rare disease hear canadian dramedy best friend live low income neighbourhood montreal quebecwhat hidden gem netflix enjoy
netflix,saw someone ask sentence summary episode go live way gonna leave comment someone could episode deleted post soooo made post spanish teacher also care netflix needed help
netflix,saw someone go vive post yesterday sub
netflix,
netflix,remembers movie theater feature probably best feature netflix ever got rid reasonfor remember year ago could host movie theater within netflix xbox live friend could join would sit movie theater together stream whatever host watching time also emotes would use xbox live avatar friend could come go whenever felt like awesomenetflix need feature back friend loved
netflix,need point ridiculous character flaw netflix suspenseful original needed stop watching awake right finally vent moment movie far religiously charged insomniac want sacrifice girl implied trailer sleep mom find daughter everyone looking love actress bitch stop fucking hug god damned conversation kid instead getting fuck absolutely infuriating stupid make character especially since supposed trained corporal le would know importance getting daughter away people want kill soon possible also damn thing extinction genuinely annoying child seemed absolutely dumbfounded stupid intentionally got audience rawled every turn wanted able power reach tv screen smack shit damn kid feel like portray people idiot sometimes get audience edge really truly annoying actually stop watching vent also trying knock movie genre extinction great guessing awake gonna good get anymore people stupidi feel like type film clearly want put audience edge wiling sacrifice plot plausibility killing damn nerve process okay done needed finally say thanks anyone actually might read
netflix,guy recommendation comedy series finished office met mother park rec arrested development brooklyn really want find something similar show find seem boring relatable really like show talk parenting etc also love drama british comedy well like show like skin crowd sick notedo folk recommendation
netflix,netflix sisyphus church scene explanation
netflix,discussion everything know killed sara netflix
netflix,netflix man new trailer happy see
netflix,reccs sad korean show recently finished watching dear freinds navillera quite liked wondering anyone reccomendations good korean show similar two show heartwarming feel like leave teaching u sort life lesson something along line looking something like watch please reccomend anything straight romance even contain please make sure minimal romance even watched two straight romance skipped scene
netflix,watching toradora phone found scene wanted screenshot turned like glitch security feature
netflix,internet connection fast enough even though lte
netflix,similar show like merlin love show merlin remember watching younger used air tv used absolutely love remember finish watching tbh saw netflix good year later watch entire thing ended loving good year line tooso wondering anyone could recommend good netflix show closely similar merlin thing looking want full cringey straight romance nothing oldi want drama interesting sense got good storyline
netflix,netflix fake ad hd television netflix showed difference hd uhd subscription uhd clearly nicer since tv hd uhd much clearer fake ad make want pay extra subscription hahah
netflix,netflix launch online shop show branded merchandise
netflix,shalom yakov lior kolontarov funny brother tim robinson think leave netflix show season coming month
netflix,learn alabama restaurant featured new netflix series fresh fried amp crispy
netflix,mobile suit gundam hathaway official trailer netflix anime
netflix,zack snyder return netflix mythology anime twilight god
netflix,sibling magical girl transformation
netflix,master universe revelation official teaser
netflix,master universe revelation official teaser netflix
netflix,password crackdown good day redditors unfortunate pleasure netflix cracking account password sharing even though one im sharing password live sibling share xbox yet required sign xbox roku tv separately watch amything tell need upgrade screen dollar even tho able go seamlessly living room xbox required signin anyone else running problem
netflix,hope netflix would one day make original series philippine
netflix,anyone comedy show recommendation
netflix,comedy show recomend
netflix,anyone recommend show like mr iglesias looking im sure know there crossover one dont know thats gabriel iglesias brings something really special show cant find anywhere else
netflix,anyone recommend show like mr iglesias
netflix,buggy fix please
netflix,netflix let skip intro play next episode
netflix,suggestion ranking video
netflix,mainstay hi looking something watch want know series everyone seen guaranteed good example stranger thing black mirror
netflix,netflix movie series seen feature
netflix,netflix movie series seen feature like youtube example
netflix,seinfeld come netflix
netflix,netflix app let log phone go log email address password correct even triple checked putting correct email password asks log also app used remember log month ago
netflix,lucifer currently binged show tv movie tracking app tv time binge session held lucifer source
netflix,unsettling discovery ragnarok
netflix,simple question buying netflix help much appreciated delete get answer answer wanna help india planning buy netflix question two part question first get watch hd basic mobile single screen plan watch account two device different time two phone might sometimes want watch second phone different time single screen plan thanks advance help also find answer google posted reddit trying karma wh
netflix,need free netflix subscription pls help
netflix,entire set beautiful cover ruined fake sticker removed
netflix,share account girlfriend
netflix,imo netflix production suck way compete big boy movie show production
netflix,show currently watching watching dark currently season netflix title total library size getting smaller focus developing original content
netflix,show watching netflix
netflix,want sell netflix account low price
netflix,anybody seen wedding guest put movie randomly pretty awesome seems action thriller ill rate cinematography action scene lead actor good sure good story whole first act pretty strong especially like bourne identity seriesfilm take place indiathe first act deep undercover operative vibe beautiful camera work majority film english
netflix,watch amazing fantasy movie reality u
netflix,please help remove continue watching list xbox one bunch series show want gone annoying please help
netflix,go live way summary spanish teacher class watch episode go live way go vive tu manera assignment however netflix tried talking teacher blew sooo need sentence summary season episode fail class anyone watched find decent summary online last ditch effort
netflix,seinfeld come netflix
netflix,anyone watch sweet tooth saw trending country today wondering good
netflix,person brazil needed
netflix,non violent animal documentary recommendation nephew love watch animal documentary always devastated one get eaten le violent documentary anyone would recommend understand pretty rare come across really appreciate
netflix,one get hired work netflix tv set stagehand year experience theater set lighting sound video never known much tv side thing experience electric production design feel would easily transfer crew get put together union freelancer bet lot location theater gotten job day friend referred even got work film shoot day also referral union sincerely gonna lie really love cobra kai know even land job production show time talk fangirl anything work professional man show cool love production especially stunt okay done thank
netflix,concrete cowboy
netflix,might late unbelievable insane
netflix,feel dancer music video afraid honest
netflix,netflix streaming worse quilty mi ultrawide monitor
netflix,feature allows separate already watched watched yet list
netflix,bo burnham funny feeling special ambient
netflix,amybeth mcnulty play vicky stranger thing
netflix,
netflix,amybeth mcnulty play vicky stranger thing
netflix,fear street film trilogy event official trailer netflix
netflix,stranger thing season add four recurring cast member
netflix,sweet tooth
netflix,mod sub think netflix exiist
netflix,help find scene hi guy looking scene netflix original title character say something along line like much nothing special personal project title character long netflix thanks bunch
netflix,pinocchio cast plot trailer release date everything need know
netflix,game news episode
netflix,many version narcoswhich one watch recently finished breaking bad got interested drug showsbut saw many version narcos idk one best
netflix,many narcos version netflixwhich one watch
netflix,kominsky method anyone else seen kominsky method scrolling netflix couple day ago see could add list watch later whether movie certain show interest came across show called kominsky method never heard believe ever promoted much netflix believe watched couple episode got soo hooked binged season kind upsetting season episode man great show anyone else watched definitely recommend
netflix,outer bank official teaser netflix
netflix,outer bank season premiere date teaser pogues run netflix drama
netflix,mbps note ultra high quality playback video quality still terrible
netflix,error code
netflix,student subreddit prefer weekend
netflix,watched show movie netflix appear watched list
netflix,check back future availability mean netflix uk spongebob icarly total drama arrested development say seen anyone know mean
netflix,think leave tim robinson returning netflix july
netflix,anyone else issue caption watching new series made caption work contact someone look caption come new series wait someone transcribe first
netflix,wish netflix would fix video caption work right
netflix,feel good subreddit feel good netflix show searching luck anyone watch show question ost song played show couple time throughout two season shazam ed nothing pop unfortunately
netflix,feel good subreddit
netflix,reign good show
netflix,audio problem someone double check dark crystal age resistance supposed atmos eps amp stereo everything else work atmos someone else see thing happens system
netflix,likesplanetcom promotephp ref davidchen
netflix,finished believe lisa mcvey story netflix never felt enraged pissed movie entire life literally hurt happened girl research found lisa forgave bobby execution literally strongas male made mad another man could sort thing one believe could happeni hate say bitter sweet feeling movie anyone going watch warned heart wrenching well emotionali also curious video disgusting creature bobby court hearing watching court case monster like lose court anyone link case recent case court send rather fun watching horrible people lose grasp life court room torn apart legal system
netflix,mitchell v machine review
netflix,yasuke season review
netflix,concrete cowboy review
netflix,neflix fixed white pixel army dead yet spent million dollar insert tig notaro zero dollar white pixel removal watch movie fixed totally break immersion guess write word minimum word character even though question simple stupid write extra crap find anyone fixed white pixel
netflix,neflix fixed white pixel army dead yet
netflix,day watching k drama series called vincenzo loving suggest asian series thing watched coming south corea japan china animei sure lot great asian movie tv series toomy favorite genre drama thriller crime fantasy romantic romantic lol
netflix,day watching k drama series called vincenzo loving suggest asian series
netflix,netflix delete account long subscription cancelled membership july never logged account since time today tried renew membership login say find email address last message received netflix membership cancellation message change email one tried chatted support helpi tried opening new account able tohas anyone experienced
netflix,ken jeong keegan michael key join mike myers series pentaverate
netflix,light quality film show dear netflix please stop filming show movie dark room poor lightning result dark almost unwatchable show film understand scene require dark environment make authentic result extremely low quality see shitfor example watched alot post appocaliptic show steam punk themed show netflix original fine lately show like shadow bone irregular filmed poor lightning environment make authentic desired time period see nothing point almost enjoyablenow anyone say oh ur tv well tried top line tv resulted even tried normal non netflix show film filmed set entirely night time fine able see everythingso please improve lightning quality program
netflix,docuseries suggestion
netflix,trying remember name film lineup
netflix,netflix global tv chief bela bajaria bridgerton la casa de papel tailoring show global audience
