subreddit,title_text_lem
AmazonPrimeVideo,find uhd version hello amazon prime video used two version title one regular one uhd want watch version look correct uhd stream usually written title logo thumbnail looking uhd version several amazon originais find thing find regular version anyone know going thanks
AmazonPrimeVideo,roku amazon prime video possible watch one movie two tv simultaneously synchronized x post r roku house tv kitchen tv family room common night various people move back forth kitchen family room various period time often need movie playing place however acoustic setup good tv synchronized exactly hear tv placesi get go wondering actual feature could turn might produce better resultsthank
AmazonPrimeVideo,el candiadato stumbled show accident seems zero promotion would highly recommendit cia spy thriller set mexico city james purefoy grizzled agent get narco drug lord trying stage political coup enlists young analyst tie mayor looking make presidential challenge spy craft action scene suspenseful relationship interesting twist turn keep guessing id hate see go rader like patriot counterpart
AmazonPrimeVideo,wild criticism bad live day age echo chamber major medium outlet celebrating show better version lost due amazon prime content accessible sub course small web cinema critic make review sometimes find article video online time silence criticism kinda deafeningi wish find someone else thay appreciate wild wish least conversation stay moderate respectful spoiler like gretchen character walking totem third wave feminism social commentary subtle way face purpose annoying sorry tame opinion tame feeling feeling disgust premise atheist sickened representation religious people series story life strange gamers religious people always bigot monster disguise like idea religious people human vary wide scale personality loud abnoxius use profanity always pulling away much incredibly abnoxius felt unreal gaining opposite effect fine lesbian love feel forced like stuff series love story summer school episode one girl awkward kid impossible mostly offended cause awkward love story guarantee best thing end put away security blanket mature hell series instead tell totally fine give cringey relationship like cause make feel good oh plus needed couple interracial cool trend saying cant interracial relationship displayed series postcard possible virtue signaling one think actual bigot call racist long interracial relationship stfu long list illogical thing inconsistency time list plot hole general think series pandering certain audience like see progressive brave imagery spouted deconstruct social expectation tell thing succeeded deconstructing respect director involved making series missed acab moment would qualify postmodernist patchwork art par exellance wish spent minute better
AmazonPrimeVideo,amazon prime video january movie tv title announced
AmazonPrimeVideo,amazon old trick skipping unwanted trailer show movie forced trailer prime content hate another storyon fire stick skip trailer pressing gt right gt ok sometimes right happen even press add show movie watchlist instead want think entirely intentional amazon one many irritation prime video guess something pay closer attention
AmazonPrimeVideo,still watch movie removed download
AmazonPrimeVideo,reasonable add disney amazon prime hulu reasonable add disney amazon prime hulu interested espn
AmazonPrimeVideo,activated two amazon prime subscription please help hi everybody today went twitch saw ad prime amazon linked card activated free tail prime seven day minute went amazon website activated free tail prime day please explain subscription compatible debited day free period day upd first activated day prime video later minute activated day amazon untied card afraid able withdraw money got scared canceled subscription day still day subscription previewreddit png width amp format png amp auto webp amp previewreddit png width amp format png amp auto webp amp
AmazonPrimeVideo,lot great movie leaving dec none added amazon prime video subscriptioncontent limited country understand licencing issue always looked prime video service could watch great old movie amazon original content never seen service could watch new movie fine thatbut almost every movie watch list see leaving dec lot great movie last year removed great movie planned watch awesome comedy great action movie gonewhat plan exactly never add anything new good constantly removing one thing great old movie list good content slim country feel like nothing left dec example heattrue gritthe man knew littlethe hunt red octobersum fearsmunichentrapmentthe fight cluball movie wanted watch one pointeverything added last month hindi movie get wrong know amazing movie coming indiajust cup tea
AmazonPrimeVideo,free nostalgia imgurcom hoping grade nostalgia entirely sure ploy trick paying ep anyone could clear thing much appreciatedhow promotional credit work buy get sort gift card added account pay walk away free nostalgia pay still magically get added evidence god exist
AmazonPrimeVideo,watch history multiple account go view watch history combine watch history profile must also mean base recommendation account rather per profile
AmazonPrimeVideo,dark uhd read others complaining prime video find solution tip link would appreciated
AmazonPrimeVideo,prime vid app data usage innactive prime video app win using approx kb download nothing streaming buffering downloading sitting static using kb completely idle sneaky shit data mining innocent horrible design anyone know edit continues pull bandwidth app closed go task manager scroll absolute bottom process list click end task stop app persistently using kb data apparent purpose
AmazonPrimeVideo,procedurals please tell procedurals movie series
AmazonPrimeVideo,full bloom finally dropped prime
AmazonPrimeVideo,guess purchasing prime video really longer term renting
AmazonPrimeVideo,problem caption working way man high castle currently coming end season loving show problem caption need caption english dialogue hoping subtitle would come automatically japanese german scene moment pause show turn english caption understand scene turn back go back englishi watching window app laptop idea fix would amazing
AmazonPrimeVideo,tom hank spot statement
AmazonPrimeVideo,season expanse go
AmazonPrimeVideo,hotel impossible removed husband working hotel impossible went watch tonight gone getting annoying keep happening
AmazonPrimeVideo,finished wild amp loved anyone want discus
AmazonPrimeVideo,rant movie going prime okay realize entirely amazon fault come across entitled rant disenfranchised virtually every movie bought recently amazon moved prime free viewing something really get skin equivalent throwing money away longer going buy movie tv show amazon reason idea added prime future fed getting burned purchasing thing eventually offered free purchased movie sixteen day ago magically added prime flaw amazon part imagine get fair chunk change way complain practice get money back done past offer refund even partial refund purchased movie move prime curious know brought amazon managed get refund least response
AmazonPrimeVideo,prime gaming included prime video subscription prime video month claimed prime gaming today asking charge prime gaming included prime video
AmazonPrimeVideo,amazon releasing show format first three episode remaining episode weekly first boy expanse anyone know amazon show treated way
AmazonPrimeVideo,short film amazon prime usa official video second short film plot amazon prime wwwamazoncom dp
AmazonPrimeVideo,prime video browser smarttv app ui amp content localization hi prime subscription amazonde german way setting somewhere app profile somewhere make ui content default english rather german know change audio subtitle even seem work fully sometimes video content bit spoken another language hard coded subtitle german english overlay subtitlesany suggestion
AmazonPrimeVideo,chance trailer itn feat vernon well available amazon prime video intentional parody arnold schwarzenegger winner arnold hosted sound alike contest
AmazonPrimeVideo,problem rewinding amazon prime video interface smart tv hi recently purchased vizio smart tv remote work fine netflix hulu however rewind fast forward amazon prime trouble shooting hour vizio seemed like amazon video interface problem realized way rewind unwieldywhen press pause button remote see yellow pause symbol middle screento left white fast rewind symbolin order rewind press left arrow remote move focus fast rewind icon turn yellow order activate rewind press center pause play button remote stop rewind hit right arrow remote center pause icon yellow selected hit center pause button pauseit unwieldy functional time press pause button rewound way beginning movie take four seperate step rewindin word proportional way rewind take several different step rewindis fix thanks advance help suggestion really appreciate
AmazonPrimeVideo,improve change video quality got amazon prime smart tv quality good directly smart tv try playing app need headphone reason drop significantly improve absolutely nowhere find video quality bitrate setting online mention option setting however try access phone pc etc missingis something unlocks free trial something
AmazonPrimeVideo,please tell movie protagonist dy movie die random order idea collect list movie protagonist dy know onesfeel free tell movie per tipe eg movie protagonist dy movie protagonist die
AmazonPrimeVideo,found debug menu amazon prime video app cheat code
AmazonPrimeVideo,short film released amazon prime official video second short film plot amazon prime usa customer wwwamazoncom dp
AmazonPrimeVideo,wild good surgery trying relax watch good show hubby good usually dystopian stuff like lost
AmazonPrimeVideo,wild half way season two thing say lord fly evil corporation shittier writing leah unlikeable character seen tv
AmazonPrimeVideo,nitty gritty movie series eg fiction character enjoy plot armor succeed survive plausibility
AmazonPrimeVideo,tenet structure explained minute tenet short analysis
AmazonPrimeVideo,thought vast night hidden gem
AmazonPrimeVideo,add stuff watch next technical problem hopefully someone answer edit watch next list remove item either computer method x ing away method highlighting remove watchlist remove list seem get back watch next queue start watching commonly buy season tv show want pick left without navigate stuff purchase amp rentalsso anyone know get stuff back watch next removed
AmazonPrimeVideo,find uhd movie find uhd movie logo movie stated movie
AmazonPrimeVideo,selective content prime video like apv mission impossible available like wise jhonney english doesnt amp
AmazonPrimeVideo,watched red fern grows loved movie kid
AmazonPrimeVideo,watched beat devil amazon prime video humphrey bogart peter lorre directed john huston
AmazonPrimeVideo,toy store near season premier christmas day
AmazonPrimeVideo,watched killer loose really good thriller worth checking
AmazonPrimeVideo,watched spy came cold really enjoyed
AmazonPrimeVideo,sign language caption watching sound metal way get caption using sign language select english subtitle nothing show asl scene
AmazonPrimeVideo,rallying keep game alive think series modern love specifically epsiode tina feyi agreed time think husband strange kind asshole part spoke child thing keeping together made feel awful scare ofr future
AmazonPrimeVideo,youview cant change profile brother owns account profile want watch youview reason change profileis way change profile watch elsewhere
AmazonPrimeVideo,watching fuzzy pink nightgown fun comedy jane mansfield
AmazonPrimeVideo,av bitrates streaming platform
AmazonPrimeVideo,ambiguous moral compass good bad ugly analysis minute spoiler
AmazonPrimeVideo,ambiguous moral compass good bad ugly analysis minute
AmazonPrimeVideo,watched big sleep nice mystery robert mitchum phillip marlow
AmazonPrimeVideo,watched invitation gunfighter great western yul brynner george segal worth watch like genre
AmazonPrimeVideo,shutter island hello reside outside u wanted ask buy rent shutter island outside u
AmazonPrimeVideo,lord ring month ago upgraded setup prepare covid lockdown including pro tv dominates room time also picked cornetto trilogy figuring movie rewatchable hot fuzz would good use technology disappointment however found prime video accept code giving basic hd version film instead pre pandemic version film got added last month sonow worried history repeating bought lotr trilogy movie anywhere fandango nice sale figured surely prestigious film collection would available watch day one prime day later appear availableis thing prime sort recurring issue getting film available know may version lotr
AmazonPrimeVideo,way fix watch next queue thing keep popping watch next already finished want finish used edit delete back next time open site deleted watched history still way hide queue permanently
AmazonPrimeVideo,watched red house really good flick edward g robinson
AmazonPrimeVideo,watched black dragon amazon prime video spooky kooky thriller set world war ii bela lugosi everyone unless fan weird wacky
AmazonPrimeVideo,watched pattern amazon prime video great movie really hold written rod sterling
AmazonPrimeVideo,special need brother buying ton movie family prime video account advice without going much detail brother special need us family amazon prime video account watch lot movie gone repeatedly watching anything account would pay individually ie rent buy account connected credit cardi think understands constantly getting bill purchase love movie hate exclude family account way make cannot purchase thing account watch available free subscription maybe make enter card information purchase anything advice handle situation thanks
AmazonPrimeVideo,wie kann man die werbung abstellen seit heute kommt bei gekauften inhalten werbung diese werden mittendrin geschaltet meine kinder verstehen e nicht da mitten bei paw patrol nun werbung f r energie drink kommtdanke f r eure hilfe
AmazonPrimeVideo,watched greaser palace crazy cult classic robert downey sr includes appearance herve villechaize really wild flick
AmazonPrimeVideo,omg wayne new sub maybe discussed sorry shout wayne liked show shameless like hesitant cause didnt recognize actor first tho actor play del dad familiar absolutely brilliant acting top notch
AmazonPrimeVideo,activate prime video without credit card got credit card validate prime video free trial come prime gaming get battlefield realized expired lol way redeem something like bank account searched google say anything
AmazonPrimeVideo,ptime video say travelling error
AmazonPrimeVideo,prime video support window either via website using edge via window store app anyone know
AmazonPrimeVideo,hitler money
AmazonPrimeVideo,different selection amazon prime phone pc started watchng mean girl phone prime video app however got home went amazon prime continue watching however movie available prime pc perfectly capable watching phone online pc something wrong
AmazonPrimeVideo,anime imma go ahead say itanime subtitle prime
AmazonPrimeVideo,everything coming amazon prime video december
AmazonPrimeVideo,watched lady vanishes good early hitchcock flick
AmazonPrimeVideo,fig pay subscription pay video say make much sense last monthslittle
AmazonPrimeVideo,uhd ov hd ov watch uhd movie original voice watch german dubbed version movie hd offer german original voice track
AmazonPrimeVideo,thought zerozerozero show worth watching possible drop review
AmazonPrimeVideo,watch video paid u outside u brother law wrote movie available amazon u canada tried paying credit card noticed billing address canadawhat get someone u buy video amazon prime account able watch movie canada wondering possible anyone tried
AmazonPrimeVideo,library indian movie hindi please help canada opened prime video virtually everything indian movie
AmazonPrimeVideo,download offline play stream chromecast data cap currently would like download season work wifi brought home stream chromecast would still offline would chromecast pull episode internet
AmazonPrimeVideo,hbo thru prime existing hbo via fios subscription login hbo subscription verizon fios deal roku fell thru able log hbo go roku watch stuff night noticed hbo option thru prime video yay find option log show already subscription possible hbo thru amazon totally separate
AmazonPrimeVideo,hey watching american horror story watch past anyone idea
AmazonPrimeVideo,need help worst customer interface planet trying continue watching something prime video tv continue watching row downon web browser amazon give everything except want watch even suggest several season watching apart episode actually way throughis quick way around really keep going another site get exact episode name search prime
AmazonPrimeVideo,prairie canadian majority anime french audio japanese sub french sub english fix bunch show even anime want watch audio french english subtitle looked everywhere fix barring unsubscribing prime amazonca resubscribing amazoncom clue fix thisany fix amazon still good place stream still
AmazonPrimeVideo,face jewish refugee soldier allied force
AmazonPrimeVideo,mirzapur season preview come next
AmazonPrimeVideo,small axe lover rock review
AmazonPrimeVideo,check uncle frank great flick sure bring tissue
AmazonPrimeVideo,prime app worked since monday lg smart tv suggestion
AmazonPrimeVideo,pause button rest bunch number feel normal
AmazonPrimeVideo,user profile android tv always using samsung tv app try using prime video app mi box bought nvidia shield get user profile prime video app put mi box spare room nephew use way access user profile sideloaded app later version version currently installed shield first time login get user profile exit next time open app profile anyway activate profile allow access kid menu
AmazonPrimeVideo,anyone else getting error code
AmazonPrimeVideo,downloading video download size select instance select download give option different size quality choose best size approximately however see downloads
AmazonPrimeVideo,streamed pretty persuasion looked like cam version watched baffling version pretty persuasion stream hd advertised looked though hd video camera recorded film projection image high contrast soft focus film scratch reel cigarette burn also sound mix muffled anyone else similar experience older movie prime
AmazonPrimeVideo,old die young get better forst episode amd holy shit awkward boring uncomfortable minute get better kind weird oddly long intro feel like show written year old incel god complex got weird greasy haired black trenchcoat wearing friend worked blockbuster year direct imma go ahead turn guy say ot get really rough start quickly get better give another shot
AmazonPrimeVideo,prime video working xbox one posting hoping google index folk issue month ago prime video app stopped loading xbox one splash screen displayed spinning circle eventually went black screen login prompt error app worked several year without issue prime video continued work laptop phoneshere step took resolve issue make claim insight uninstalled reinstalled prime video app xbox one fail unplugged xbox one minute restarted xbox fail cleared mac address xbox advanced network setting fail deleted xbox account xbox hard restart xbox added xbox account back xbox fail unplugged hardwire connection xbox added wireless network connection wifi success amazon prime xbox app loaded successfully error reconnected hardwire connection xbox confirmed hardwire connection active xbox fail amazon prime video failed load issue previous cleared mac address xbox advanced network setting success amazon prime video app loaded successfully error
AmazonPrimeVideo,apple itunes subscription hey guy wondering cannot subscribe amazon prime iphone kept clicking subscribe nothing happened brought next page say continue brought back home page fix
AmazonPrimeVideo,james may oh cook release worldwide title pretty self explanatory live argentina south america change
AmazonPrimeVideo,suggest best show prime video seen night manager missing fleabag mam high castle hunter absentia mcmafia
AmazonPrimeVideo,enable different subtitle time extension
AmazonPrimeVideo,watch episode episode everytime try continue episode watched ep boy go episode one even downloaded entire seriesstill find episode downloads amp used issue etc would mostly done finish force next episode annoying massively annoying fix
AmazonPrimeVideo,award category would borat one night miami get nominated
AmazonPrimeVideo,watch grand tour find new season grand tour anyone know watch
AmazonPrimeVideo,watch next gt shit already watched wtf amazon site need cleansed fucking fireps back button mouse redefined webplayer start pause forcing actually click actual back button browser toolbar get back main page apparently functionality swapping functionality around unrecognizable borderline useless assume consequence going generation developer taught program generation developer go school zero innovative capacity whatsoever make arbitrary change week week basis busy call development
AmazonPrimeVideo,blurring scene shameless recently started watching shameless prime video reason every nsfw scene blurred anyone else facing issue
AmazonPrimeVideo,watch season two westworld would advisable watch first one watched two year ago absolutely loved iti remember watched ended unlike series binge watch store brain small side storyline carry one
AmazonPrimeVideo,watch apv via box dad owns ipad air everything updated prime subscription downloaded apv app try watch stuff ipad tv screen sharing similar youtube app youtube tv wich work u buuut gt seems tv compatible year old sony kd ofcourse wanna buy annnnother tv apv app tv apps section netflix youtube weird onesi heard multimedia box either app included ready downloaded box store others need download apk install somehow usb drive touch forbidden setting multimedia box heard would apple tv xiaomi mibox similar name want complicate setting thing also want spend fortune apple tv apple apvmy question good box device either control via ipad air screen sharing use controller navigate setting via tv apv app already included able download store simply install apk way thanks advance
AmazonPrimeVideo,using window app automatically skip trailer intro recap using window app way automatically always skip trailer intro recap show three nuisance skipping every new episode amp thanks
AmazonPrimeVideo,small axe mangrove review
AmazonPrimeVideo,recent change movie listing amazon prime video roku hello father elderly life distance away like watch movie amazon prime roku week told listing movie changed used see movie thumbnail screen could scroll see one movie time scroll anyone know ui change last day gotten different screen changed setting accident amazon prime roku device thanks help
AmazonPrimeVideo,anyone seen amazon prime indian show paatal lok definitely check fantastic perspective lead character series please let know thought thanks time
AmazonPrimeVideo,using code login smartphone mean possible add smartphone registered device instead login account need code android app see option
AmazonPrimeVideo,legend el cid trailer hd
AmazonPrimeVideo,amazon prime video subtitle
AmazonPrimeVideo,release date james may oh cook turkey
AmazonPrimeVideo,exclusively french content canada hey enjoying prime video quite exclusive content visiting old stuff well scrolling caught eye couple anime watched quite quite excited watch unfortunately though french option english version content neither audio subtitle instead french confused first thinking changed messed setting location set somewhere quebec whatever reason would seem version available canada reason way get around rather get whole new membership gain access another option possible
AmazonPrimeVideo,could someone help video quality
AmazonPrimeVideo,buy office u prime still access go solely nbc streaming platform read never really movie show buy like long term rental amazon delete library variety reason including streaming restriction
AmazonPrimeVideo,filter content requiring additional subscription searching way filter paid content annoying search scroll find something interesting find need pay additional fee anyone know remove filter title included prime
AmazonPrimeVideo,rabbit hole find man find crazy forgotten stuff low budget horror movie went forever taste fantastic best stuff find scrolling bottom series movie page seeing people watched movie watched click movie also list customer also watched go infinity give minute get hilarious low budget one shamelessly venture time find wonderful gem accident browsingjust found movie starring richard pryor amp eddie murphy never seen sweet find called harlem night want add itoh would highly recommend fleabag give two episode pilot awkward suggestion find please sharei like older stuff comedy sometimes new stuff right
AmazonPrimeVideo,scrub available download though
AmazonPrimeVideo,free prime video show free watch amazon prime video different device mostly nebula projector echo show projector show sometimes show one tv faves available prime u go check phone available anyone else run super annoying
AmazonPrimeVideo,amazon prime video android tv undoubtedly worst ott platform used seen take forever start app always show problem select watch always error first try watching series show automatically go next time show problem take forever start next episodeduring forward reversing video take second video quality worsens sometimes show error go back start againseriously one richest company design dogshit appthis totally different mobile app mobile run smooth
AmazonPrimeVideo,see resolution playing like netflix hey guy would love know possible know resolution playing window app samsung tv app know netflix tv press info window press ctrl shift alt amazon find anything
