subreddit,title_text_lem
netflix,movie title okay bare please let say watched movie believe netflix know actor movie made time seemed relatively new definitely fell suspense thriller really blurry remember liking lot anyone give name suggestion would great main character female believe house keep custodian work think end cleaning man house played sort classical instrument seemed others love interest well anyways forgot basically whole plot remember come end movie revealed sort prodigy think cello old instructor done dirty past end plotting kind murder ugh really remember much would really like watch movie anyone would able help please thank
netflix,season cancel dear netflix specifically joined group voice growing dissatisfaction business modelwhile immense library established show approach netflix exclusive really starting make wonder invest watching themwe understand youre subscription based model excludes advertising income requires get new repeat subscriber maintain green also understand ip cheaper licensing ip however standard model canceling show season really starting annoy longer invest seeing show knowing going cancel might get lucky see third fourth know rare exceptionso option simple watch give crap watch cancel focus option either way deep pocket miss one subscriber however feel may canary model dying stop canceling great show season two least sell amazon invest good quality long run good show albeit lot le least look forward seeing show develop time tl dr netflix stop forcing show one hit wonder
netflix,army thief set release later year
netflix,thought
netflix,frontier
netflix,trying understand download restriction window app making senseone specific tv show able download entire first season episode season get getting error message gt need remove downloads device another device plan info go helpnetflixcom thing frustrating download episode show combined fact season easy download going camping weekend bit flustering
netflix,new dayz tv series announced flix
netflix,international recommendation looking international tv show netflix seems many gem seen finished lupin amp dark started money heist also good martial art film similar raid seen night come u headshot amp triple threatthanks advance
netflix,secret movie glitch went watch pandemic netflix directed john suit played totally different movie called alone also pandemic movie advertised thought weird movie watching synopsis reading match alone pretty good movie continued went search alone exist netflix super confused guess accidentally added wrong movie every time click pandemic play alone instead pause movie still say pandemic canada btw
netflix,ragnarok oof tapeworm eat much day seeing mean whyyy also little annoyed closely retreading old myth instead like continuing relationship working trauma pastotherwise enjoyed show especially laurits best loki mirror scene great want see trickery secret heroism though
netflix,prosecute need closed caption
netflix,importance travelling education
netflix,chance bird box really enjoyed first one since second novel released would love see sequel movie ending left cliffhanger possible fellow bird box fan think high interest sequel
netflix,started watching kominsky method today comment hell jane seymour still one beautiful woman world show real walk memory lane lot big star seen almost showing age jane seymour still stunning ever truly remarkable
netflix,thanks jupiter season
netflix,army dead
netflix,watched big lebowski netflix maybe coens best
netflix,jupiter legacy season canceled netflix focus supercrooks spin appear first anime series later year
netflix,jupiter legacy canceled netflix
netflix,one series mother birthday later child kidnapped killed lead day repeating another chance save meet guy work together find child movie end pier think
netflix,saw dirty john betty broderick christian slater play great scumbag lawyer watching betty broderick season dirty john disturbing asshole christian slater character play asshole well gonna take see anything asshole
netflix,money heist season
netflix,pandemic incorrectly playing alone netflix canada
netflix,mario casas
netflix,traveler season
netflix,made one hardest quiz lucifer anyone want give go
netflix,movie make cry
netflix,season one piece finished one piece netflix offer definitely preferred way watching show anyone know add rest show
netflix,benefit watching series considering starting series netflix benefit watching series mental health emotional expression anything else know time consuming watch series type person like put time good use instead wasting
netflix,benefit watching series
netflix,best series watch either netflix prime stuff seen love money heistsnow piercer shadow bone friend watched powerupload super storehumansbridgeton dynasty dirty johnyou mindhunter
netflix,real good series hi everybody would like ask really good series character make annoyingly stupid decision irritating bad guy get punished hard
netflix,remembers guy first episode love death robot
netflix,full house back netflix canada watching day ago said leaving may gone maybe half day back thought weird complaining
netflix,debate watch netflix yield interesting result
netflix,make quality option opt advanced feature know streaming service use automatic quality system prevent user error save money bandwidth someone like good video audio quality really disappointing cant pick resolution bitrate dynamic range codecs want watch optional advanced setting would still keep benefit using automatic system casual viewer care best quality experience give u option get reliably high definition experience despite netflix subscription find constantly downloading movie show external site best quality experience seriously lessens value subscription
netflix,block tv show sister netflix profile sister kid profile inappropriate tv show still mind watching prevent mom getting pissed fault block specific tv show sister profile
netflix,lucifer season new info leaked production member series
netflix,causing glitch fix
netflix,watched nail bomber manhunt john tyndall bnp suck wow really amazed people like john tyndall far right activist british national party real asshole believe people listening kind racist nonsense stupid glad right belongs
netflix,movie series recommendation
netflix,downloading want download netflix downloading netflix want download found efficient way download netflix series movie found way software limit many minute could download barely got start one episode tried download efficient way download series movie netflix need help would nice got answer june tl tr wanna download netflix series movie figure efficient way
netflix,downloading
netflix,season kim convenience netflix
netflix,netflix subscription account work used people netflix account long time friend need purchase familiar profile slot make account however current specification per month cheapest membership allows subscriber watch one device time standard definition per month standard subscription viewer watch hd two device time month premium subscription viewer watch ultra hd available four device timefirstly premium allows screen time mean profile mean many people watch someone profile make much sense essentially want profile able watch netflix whenever someone explain
netflix,looking specific show know name
netflix,anyone else got idea content netflix kid wildly inappropriate put gf kid got lot fun family film nestled amongst army dead stranger thing fifty shade grey sex education breaking bad narcos american horror story deadpool santa clarita diet ton shit would dream letting seven year old watch
netflix,people looking show similar breaking bad better call saul ozark highly suggest crackle drama startup first season streaming netflix show little known spread word get season
netflix,wrong movie netflix canada trying watch movie wwwyoutubecom watch v sllhjhiswpo appears netflix wwwnetflixcom search q pandemic amp suggestionid amp jbv play movie thats never seen happen really blame addiction zombie movie
netflix,get netflix trusted verified refund anything happens
netflix,removing netflix original hey guy first post group im really looking answer watched bo burnham special netflix may came qanted rewatch june already gone quick google search show netflix released special click watch enter local netflix idea bug certain netflix original also removed local netflix sound crazy since netflix right produced anymore
netflix,black lightning
netflix,need help netflix app samsung smart tv model code working error code nw impossible network issue internet working perfectly app tv tried unplugging resetting tv yet luck
netflix,watched believe abduction lisa mcvey believe family believe tried tell grandmother kidnapped amp raped mother grand prize either real piece shit recommendation tho
netflix,wtf netflix possible watching show netflix close app reopen le minute later show impossible find cancelling today garbage curious attack titan
netflix,question jojo bizarre adventure part season golden wind come netflix since part diamond unbreakable season already came netflix may year part golden wind season come netflix catching part since came episode inpart already work also come finished
netflix,question jojo bizarre adventure part season golden wind come netflix
netflix,ragnarok season good liked first season kinda cheesy vibe thought got lucky able pull another decent season surprise however season even better first one pretty solid show far think adapted mythological being well modern setting whole teen drama thing cast excellent although feel like many people watch netflix put much effort advertise brink getting cancelled
netflix,would netflix remove brokeback mountain may june start pride month started brokeback memorial day weekend never seen fell asleep minute left saw removed yesterday guess finishing
netflix,gst pst
netflix,gst pst tax starting july think
netflix,much drama tacked show every show synopsis like x fight villain meanwhile z confronts wife affair actual one saw tasked church investigate prophet find mother dating miss memo people like
netflix,spoiler eli movie
netflix,best series ever netflix fumacromcom check lol
netflix,come available language subtitle varies device account specific example lake different account fire stick show japanese subtitle language option different account roku one show japanese subtitle language specific difference setting nyc sure curious might stuff japanese sub would great thought appreciated thanks
netflix,watched thinking ending thing ngl movie weirdest shit ever seen spoiler kinda liked time kinda like honestly think jake playing scenario woman long time end see ton ice cream cup trash near school kept replaying fantasy think woman changed name occupation story actually one fantasy showed u couple scenario thought alternatively could trying place point time fit changing well parent jake lonely janitor probably rejected many time life felt control life created fantasy completely control saw lucy thinking ending thing could hear thought happy even control fantasy anymore first think name thinking ending thing refers woman want leave understand talking jake wanting dieanyways movie fucking weird bro
netflix,mitchell v machine get honest feedback saw raving review movie getting saw imdb rating saw r movie post hundred people saying never laughed harder moviecan get opinion able watch halfway utter cringe forced internet culture joke became much get dad boomer understand technology get daughter zoomer big tech mad dad understand throw hundred forced joke good timeother animation pretty good enough finish itopinions like joke make laugh plot seem new let hear
netflix,netflix please stop spoiling show
netflix,ya later shtinky
netflix,gypsy actually worth time
netflix,r thelastairbender begun new viewer friendly watch avatar tla
netflix,yk netflix series criminal mind confused chain thing head name gideon owns
netflix,employee reading demand
netflix,need tv show recommendation
netflix,netflix firefox problem firefox ok version issue appeared four five minute end video screen freeze several second sound go rewind watch problem second time see movie unless watch end credit tv show noticable annoying climax episode amp know fix downgraded ff turned update fine today ff released error still appears longer supported amp use older properly working version newer version bug anyone know solve either issue
netflix,relise rickan mortor season
netflix,many zombie series
netflix,netflix
netflix,reccomendations
netflix,lie april
netflix,enjoying sun
netflix,new bo burnham special one genius thing ever seen
netflix,oxygen really good movie oxygen really good movie watched movie one best netflix original year time really good acting story probably everyone claustrophobic movie single setting certain element review also really adequate time hope movie quality
netflix,height star melissa barrera lead netflix survival drama series breathe
netflix,show binge struggling finding new series
netflix,watch phone
netflix,tried everything error code presistent updated firefox relaunched firefox cleared history cleared cache installed entire firefox app updated window checked latest update disabled anti virus disabled vah pah enn installed window cannot use netflix anymore due error
netflix,error code tried everything
netflix,error ui tried everything work anymore using netflix app lg smart tv latest version firmware software never issue went use today hit error step netflix troubleshooting guide specific error nothing work reset tv router uninstalled app logged device tried everything app working every device fine googling seems get error screwed really want factory reset tv picture setting install everything else anyone else issue resolved
netflix,netflix ripping markiplier podcast
netflix,julie julia migraine wanted watch wholesomeness julie julia netflix canada btw gone watched like time netflix think last time two month ago gone
netflix,new sign account another continent noticed email get sent every time reset password say login detected location bihar india know say may match exact location far away live europe also get another email new sign account actual correct location bigger city near mine also changed password email still get location india super hacker missing something location device android phone location haryana india well dont use netflix phone
netflix,imagesappgoogl
netflix,season episode thanks shes gorgeous
netflix,everyone thought stranger thing like title say thought personally love show first season better fair hope delivers better wait
netflix,funny cat dog
netflix,america motion picture channing tatum official trailer netflix
netflix,android app working anymore black screen subtitle try watch something since updatesonly reason still keeping tv cable lame least work pc tv
netflix,atypical netflix set season premiere date first look photo
netflix,rick morty best
netflix,breakdown analysis cecil hotel
netflix,monarca
netflix,wendell wild cast plot trailer release date everything need know
netflix,hey everyone problem netflix app tv see video anybody know fix
netflix,netflix total rip computer performance apart tried three different browser edge chrome firefox netflix total crash cpu whenever even tab netflix open need restart computer hang ups every five ten second stopis working solution quite month
netflix,homeland know month behind never got watch series homeland much going family commitment moving etc get series homeland tx
netflix,anyone seen evil genius
netflix,iconic neonazi movie brother brother coming netflix
netflix,remind feature working usually add bunch upcoming show reminder list releaseremind button still tv app retain reminder set tag browse away title behavior android io even find thr button anymore iosis feature going away also noticed actual notification show add happening anyone else
netflix,netflix
netflix,homeland
netflix,sky hi netflix account sky good used log via family member account longer subscribeis sky one hd allow log another devicetx
netflix,feature allow people supercut edit tv show movie
netflix,question
netflix,way watch cowboy bebop anime netflix
netflix,saw feed brother netflix recommend enough context old russian action drama philosophical slow burn piece first one particular second much worse still ok brutal violent describes post soviet life russia pretty welland music fantastic lot russian post punk psychedelic rock
netflix,paint protection film installation car bike paint protection film delhi
netflix,sharing netflix account family member
netflix,gift season official trailer netflix
netflix,word honor loving wuxua tv show everything cinematography script story acting fighting humour brilliant big fan wuxia film like crouching tiger hidden dragon hero house flying dagger wanted show like
netflix,happened someone else well netflix signed saw needed updated anyone else netflix also sign updated also third time netflix logged two tge time updated software happened someone else well
netflix,really gonna pretend underground really gonna pretend underground kurdistan getting shit housed turkey syria iran murrica kudos ryan reynolds even sthe embodiment ghost mercenary moneyat least pretend superheros
netflix,irregular overall decent show bit formulaic yo yo ish teeny bopper vibe trying hard throw gore enjoyable enough though time killer normal slow summer month programming one thing annoyed bit attempt hyper inclusive far better representation part poc lgbtq also something said realistic portrayal time place royal coming ball almost poc openly gay couple attendee unfathomable time would far effective showing environment stuffy uptight obnoxious held true reality white entitled repressed much excluding oppressive anyone within demographic
netflix,netflix display smart tv color second click watch show play black white help fix
netflix,recent recommendation recently someone recommended ferry undercover wanted say thank movie ferry excellent half way season undercover really enjoying wellso thank
netflix,darkest hour
netflix,anyone know country transformer last knight
netflix,come hater
netflix,come
netflix,tv show grandpa grandpa couch watching lot tv lately wanted find show netflix like woodworking home improvement show spaghetti hokey western show like netflix please let know thanks
netflix,netflix recommendation
netflix,binge
netflix,suporte ergon mico
netflix,dark greatest tv show ever made know know like serious thought provoking adult drama owe self watch watch trailer read anything watch prepare amazed
netflix,someone let borrow netflix read want borrow like minute hour change password want test buy subscription mean desperate person ask favor like sorry piss one
netflix,army disappointed acting stale first zack snyder film watched sure hype nothing would suggest real chop beyond marginal eye sub par action sequence
netflix,protip better streaming quality window pc
netflix,subtitle consistently ignore dialogue instead caption song background side conversation fix example listening japanese audio english subtitle angel beat first episode around minute scene dialogue music play background instead subtitling actual dialogue subtitle preferring caption song instead see character saying
netflix,army dead terrible stop letting zach snyder write rip movie half time list movie ripped ocean acceptable since whole selling point starting weak alien basically entire real plot corporate traitor except make sense betraying anyone see screwing line revenant bear scene zombie tiger side note tiger lay car yawn king zombie ordered avenge dead queen baby side side note glowing zombie baby predator little acceptable cause probably used movie whole probably gonna die cause monster buff dude let hand hand thing end king zombie omari character bvs bulletproof cowl literally ripped movie guess okay jeez called king zombie batman seeing riddick zombie come rain even though never happened still putting cause movie deserves good indiana jones seriously casino vault boobytraps little unsafe regular worker little illegal premeditate murder even protect something volcano reaching remember old volcano movie tommy lee jones seen firefighter save child jumping lava throwing last part montage bautista soldier comrade running little girl get overwhelmed except reason saving girl decides go back hug otherwise random soldier met drop cargo box head legend whole idea zombie king queen couple attacking group cause wanted back avenge stuff hated kate sucked know watch moviegeeta decided blind staring nuclear explosion instead helping kill kung fu king zombie helicopter themthe german safecracker even need tanaka know combination safe lost vega somehow dont mention seemingly unnecessary also super annoying screaming like teen girl might funny people made want die fact paused whole slo mo music video section ask kill zombie kill zombie made hate beginningthey save girl awesome heartpounding scene movie seriously made hate worst part guy friend guy closest guy planning scene got dude chicken face wanting go stood watched blew got bitthey kept bringing people last minute even though possibly fit helicopter money first kate reason kate came get geeta already assuming extra coyote girl walk rapist guard seduces coming extra body somehow fitting helicopter whole team money point anyone question almost wish made see try clown car therethe traitor dude humping zombie queen decapitating zach snyder rape fetish change mindthe robot zombie much say even honestly forgot remember really hatred inciting incident whole idea road head causing zombie apocalypse sound good say loud also soldier tasked protecting truck take one team instead letting cargo fellow soldier die get crap soldier paying attention make worse bother defending dude lose tooth swerving sand time loop thing idk ever gonna explained dumb could point possibly seems like loop broken end ever one cause omari character gonna infect worldbautista love interest bad issue forgot existed end flirting bautista dy saw thought awesome lady save jumping window like wait die flirting going offering point zombie let people walk around throw person queen ridden zombie tiger like king horse captured turn rapist guard immediately keep woman around say could saved diedthat chris stuckmann make hilariocity seriously man looking forward stuff liked action good thanks completely sucking moviethe zombie tiger probably best character film wish montage least showed zoo something assuming ate animal let king turn horse cause animal
netflix,hello people issue bugged
netflix,new netflix series chronicle tragic story austrian empress
netflix,hello people issue bugged
netflix,netflix deleted account without warning trying login account see show catch interest surprise told account exist given email googled googled apparently netflix delete account inactive month canceled payment month ago found weird since gotten sm email account danger deleting normal behavior
netflix,seinfeld
netflix,bo burnham inside amazing
netflix,netflix rn
netflix,remember everyone arm cuties netflix people thought sexualized young girl anything said bang gang story teenage girl f cking multiple people netflix wtf remember everyone arm cuties netflix people thought sexualized young girl anything said bang gang story teenage girl f cking multiple people netflix wtf
netflix,remember everyone arm cuties netflix people thought sexualized young girl anything said bang gang story teenage girl f cking multiple people netflix wtf
netflix,subtitle nice sometimes watch netflix show native language put subtitle understand joke bit better eating chip mean understand people cannot hear sound subtitled sound effect really useful people hear take space take attention away possibly beautiful scene heck subtitle say could translate right subtitle alone need subtitle option need subtitle every really every sound non english speaking people
netflix,netflix download reached trying download movie phone keep getting message reached maximum allowed movie show checked device nothing downloaded well phone enough storage anyone know happening
netflix,discovered
netflix,tell actually available hdr upgrading hi like upgrade netflix subscription like actually know watch hdr upgrading watch much waste thing interested available higher qualityi understand type hdr etc search bar return comprehensive list selection seems limited surprised see recent movie addition eg arrival appearingany idea really useful display title could watched hdr even package yet else know whether worth upgrading
netflix,bo burnham inside bubbs review
netflix,breaking boundary science planet
netflix,netflix party roku google absolutely help hahasome site say use app well thanks need step step see anything initiate watch party
netflix,please suggest good series film etc
netflix,today last day watch rememory peter dinklage thought provoking emotional film memory would like access memory thing best forgotten fine performance peter dinklage julia ormond late anton yelchin
netflix,miraculous season
netflix,app roku working last day every time try open netflix act like opening show black screen netflix red kick back roku home screen first time let way app problem randomly kicking watching show anything wondering anyone problem roku netflix streaming apps working fine
netflix,anyone know show name
netflix,get netflix premium available wwwfacebookcom sharecontents ott account sharing service amp enjoy youtube premium enjoy netflix amp waste money enjoy cheap ott service sharecontentsfor information please contact u via facebook messenger wwwfacebookcom
netflix,gray man cast plot trailer release date everything need know
netflix,dear netflix community
netflix,dear netflix community
